company,job,summary
Baxters,Coupa Support Analyst," Coupa Master Data Load. Ability to configure data and create test cases. Functional and Technical Analysis of recurring issues, performance issues, data volumes..."
AstraZeneca,BI/Microstategy Developer, Data Integration/ETL experience is a plus. Understand the fundamentals of a dimensional data warehouse model and how to optimize the way data is organized for...
Ooyala,Senior Big Data Engineer," BS/MS or PhD in Computer Science or equivalent. With it's Big Data heritage and market-leading analytics, Ooyala delivers extremely personalized media..."
DXC,IT Operations/Support Analyst - workplace & Collaboration," Operating system, hardware, data center, security, network, voice, end user and serverweb related applications)...."
DXC,IT Operations/Support Analyst," Operating system, hardware, data center, security, network, voice, end user and server / web related applications)...."
HP,Intern for IT Business, Data driven problem solving skills. Continuing final year of a Bachelor’s degree program in electrical or computer engineering or computer science....
Kueski,Data Engineer-Big data, Participate in exploratory data analysis and partner with data scientists to provide stakeholders an in depth understanding of the data....
amdocs,System Admin," In computer science / Electronics / IT. From virtualized telecommunications networks, Big Data and Internet of Things to mobile financial services, billing and..."
HP,LATAM Print Operations Internship, Or Data Science related degrees preferred. Education and Experience Required:....
HP,North America Physical Claims Intern, Data Science Report (Power BI tool(. Apprentice includes students working at hp who are enrolled in apprenticeship programs in association with their university...
Herbalife Nutrition,QA Analyst," Proficiency with SQL queries and data analysis, ability to work with large amounts of complex data in both a batch and interactive environment...."
Baxter,Coupa Support Analyst," Coupa Master Data Load. Ability to configure data and create test cases. Functional and Technical Analysis of recurring issues, performance issues, data volumes..."
HP,IT Analyst Global Finance Operations," Operating system, hardware, data center, security, network, voice, end user and server / web related applications)...."
Kueski,Middle/Sr. Data Scientist," Analysis of data. As a Data Scientist you will integrate knowledge in Data Analysis, Machine Learning, Statistical Analysis and Programming to:...."
Scalable Press,Project Manager," Bachelor’s degree (preferably in a technical discipline, such as computer science, engineering, math, or economics)...."
Kueski,General Manager," We are building one of the best engineering and data science teams in Latin America, focused on improving the lives of millions of people underserved by..."
Intel,Hardware Design Intern," Collect information, analysis data and provide summary reports. Enrolled in a college program and currently studying to get a Bachelor or a Master of Science..."
Kueski,Product Manager," Identify opportunity areas in current systems that provide service to internal areas (Operations, Marketing, Data Science…)...."
amdocs,WebSphere or Weblogic Engineer," Bachelor's degree in Computer Science, Engineering or a related discipline. From virtualized telecommunications networks, Big Data and Internet of Things to..."
amdocs,Technology Engineer," Bachelor's degree in Computer Science, Engineering or a related discipline. From virtualized telecommunications networks, Big Data and Internet of Things to..."
DXC,IT Ops/Support Analyst," Operating system, hardware, data center, security, network, voice, end user and serverweb related applications)...."
TaleXa,Fullstack / NodeJS / React Developer Remote for SF company," Bachelor’s degree (or higher) in Computer Science, Engineering or similar and/or relevant work experience. Support front end APIs and real-time socket feeds so..."
Oracle,Internal Customer Tech Support 3-IT," Information, and other related data. Bachelors and/or Master Degree in Computer Science. Analyses data to identify early warning signs for incidents and updates..."
HP,"Cash Forecasting Process Design, Analytics and Operations"," Excel, PowerPoint MS Access Data base, SQL Advanced analytical skills. First level university degree with a focus on Math, Statistics, Finance/Accounting or..."
amdocs,COBOL Engineer," From virtualized telecommunications networks, Big Data and Internet of Things to mobile financial services, billing and operational support systems, we are..."
EPAM Systems,Big Data Developer," We are looking for people with strive for self-development who are keen on data science and eager to work with Big Data tools and frameworks, NoSQL databases..."
Kueski,Security Officer," BS/MS in Computer Science, or equivalent. Kueski is disrupting the consumer lending industry globally and changing the way credit risk is assessed with machine..."
amdocs,TIBCO Software Engineering," From virtualized telecommunications networks, Big Data and Internet of Things to mobile financial services, billing and operational support systems, we are..."
EPAM Systems,Senior Business Analyst," Degree in Business Computer Science or similar education. Migration of customer master data, onboarding of merchants...."
amdocs,Software Engineer," From virtualized telecommunications networks, Big Data and Internet of Things to mobile financial services, billing and operational support systems, we are..."
amdocs,Technology Specialist (Weblogic)," A university degree in Computer Science, Information Systems or equivalent Engineering degree. From virtualized telecommunications networks, Big Data and..."
Baxter,Jr. JD Edwards Technical specialist," Master Data Management(MDM), Warehouse management , Hardware tracking. Logistics, Transportation, Order Management, Master Data Management...."
Oracle,AI/Machine Learning Software Developer, Think creatively about delivering industry leading designs that leverage the value of automated outcomes driven by large scale data and data science....
Baxter,"JD Edwards, Technical specialist"," Master Data Management(MDM), Warehouse management , Hardware tracking. Logistics, Transportation, Order Management, Master Data Management...."
Oracle,Senior Business Intelligence Engineer," Drive platform maturity for data store, data mart, data pipes and other data distribution services. SQL proficiency, expertise with data mart design principles,..."
Intel,HPC Performance Engineer," Bachelor degree, Master of Science or PhD in Computer Science, Computer Engineering . The data center is the underpinning for every data-driven service, from..."
Baxters,Jr. JD Edwards Technical specialist," Master Data Management(MDM), Warehouse management , Hardware tracking. Logistics, Transportation, Order Management, Master Data Management...."
IQVIA,Representante de Ventas Jr (Farma) GUADALAJARA (Temporal)," IQVIA is The Human Data Science Company, focused on using data and science to help healthcare clients find better solutions for their patients...."
Cognizant,AS400, Science / Engineering Graduate. Plan document and data requirements. Participate in requirement gathering JAD sessions and support documentation where...
amdocs,Java7 Support Specialist," From virtualized telecommunications networks, Big Data and Internet of Things to mobile financial services, billing and operational support systems, we are..."
Baxters,JD Edwards Consultant," Master Data Management(MDM), Warehouse management , Hardware tracking. Logistics, Transportation, Order Management, Master Data Management...."
amdocs,"Software Engineer (OSB, SOA)"," From virtualized telecommunications networks, Big Data and Internet of Things to mobile financial services, billing and operational support systems, we are..."
Cognizant,MS Dynamics Consultant," Bachelors in science, engineering or equivalent. Plan and perform data migration into the new systems. (Writing JScript, Developing/Registering plug-ins,..."
Plexus,Process Engineer l," Conduct analysis of process metric data to assess efficiency and effectiveness. Ability to apply knowledge, logic and reasoning using mathematics, statistics,..."
amdocs,Software Support Team Lead," From virtualized telecommunications networks, Big Data and Internet of Things to mobile financial services, billing and operational support systems, we are..."
amdocs,UNIX & LINUX Expert," In computer science / Electronics / IT. From virtualized telecommunications networks, Big Data and Internet of Things to mobile financial services, billing and..."
amdocs,Software Engineering Team Lead," From virtualized telecommunications networks, Big Data and Internet of Things to mobile financial services, billing and operational support systems, we are..."
Kueski,VP of HR," We are building one of the best engineering and data science teams in Latin America, focused on improving the lives of millions of people underserved by..."
amdocs,Integration expert (Product deployment)," Bachelor degree (4 year program) in Computer Science, Engineering or equivalent. From virtualized telecommunications networks, Big Data and Internet of Things..."
Kueski,Software Engineering Manager," BS/MS in Computer Science, or equivalent. Kueski is disrupting the consumer lending industry globally and changing the way credit risk is assessed with machine..."
amdocs,Software Engineering Specialist," From virtualized telecommunications networks, Big Data and Internet of Things to mobile financial services, billing and operational support systems, we are..."
Bosch Group,Software Project Manager," Metrics / data collection, analysis for the project and status reporting. The project Manager is responsible for leading SW project team in development/Testing..."
amdocs,SW Test Engineer," /B.SC in IT/ Computer Science/ Industrial Engineering/ Systems Analysis. From virtualized telecommunications networks, Big Data and Internet of Things to mobile..."
AstraZeneca,Senior Release Engineer," Bachelor degree in Computer Science, Engineering or other related fields. Experience in Data and Information Management strategies, operations, and technologies..."
Intel,HPC SW Validation Engineer," Bachelor degree, Master of Science or PhD in Computer Science, Computer Engineering or related with at least 4 years of experience in Software Development..."
Baxters,"JD Edwards, Technical specialist"," Master Data Management(MDM), Warehouse management , Hardware tracking. Logistics, Transportation, Order Management, Master Data Management...."
Oracle,DevOps / SRE, BS Computer Science or equivalent qualification from a renowned institute. Experience in large-scale data center builds and application services deployments...
amdocs,Software Support Engineer," From virtualized telecommunications networks, Big Data and Internet of Things to mobile financial services, billing and operational support systems, we are..."
amdocs,Java Engineering Specialist," From virtualized telecommunications networks, Big Data and Internet of Things to mobile financial services, billing and operational support systems, we are..."
NTT,SAP S4 Logistics Functional / QM," NTT DATA, Inc. About NTT DATA Services. Bachelors in Computer Science or equivalent work experience. At NTT DATA Services, we know that with the right people on..."
Bosch Group,Blockchain developer," Understanding of algorithms, data structures, cryptography and data security, and decentralized technologies. Work in collaboration with other specialties such..."
amdocs,C++ Support Engineer," From virtualized telecommunications networks, Big Data and Internet of Things to mobile financial services, billing and operational support systems, we are..."
Intel,System Validation Engineer," In Electrical Engineering, Computer Engineering, or Computer Science. Own system level validation activities for platform and commercial Intel Data Center..."
FreeAgent CRM,Full Stack Developers," Experience with database design schemas and data modeling. Outstanding software engineering skills such as data structures, algorithms and programming...."
Open Market,Software Development Engineer, A Bachelor’s Degree in computer science or equivalent experience. Thorough understanding of persistence (SQL or NoSql) and data modeling....
Svitla Systems,SENIOR BACKEND ENGINEER," Experience with data analytics. Design, develop and maintain code enhancements in the MapD Core Data Engine...."
amdocs,SR ETL Developer, Designs data storage systems and works to fill that system with the data that needs to be stored. Manage the process of loading business data into a data...
Intel,Engineering Manager," The Data Center Group (DCG) drives new products technologies from high-end co-processors for supercomputers to low-energy systems for enterprise and the cloud,..."
BlueOptima,Principal Software Engineer," Minimum Bachelor's degree in Computer Science or equivalent. You would be working on a complex single page web-application, which is data heavy and involves a..."
amdocs,Functional Test Engineer," Bachelor’s degree in IT/ Computer Science/ Systems Analysis or related. From virtualized telecommunications networks, Big Data and Internet of Things to mobile..."
Oracle,Software Developer 2," Solid knowledge of Data Structures, Algorithms, Operating Systems, Object-Oriented Analysis and Design, and other core Computer Science areas...."
Oracle,SysAdmin - Site Reliability Engineer, Databases and big data stores. BS in Computer Science or related field. It runs in 19 data centers around the world....
Cognex Corporation,Technical Support Engineer," Bachelor’s Degree in Computer Science or Electrical Engineering, or equivalent. In order to detect, identify and localize objects, make measurements, inspect..."
Intel,Linux System Developer Engineer," Degree in Computer Science, Electrical Engineering, Computer Engineering, or other related engineering disciplines with four years of relevant experience or M.S..."
WIZELINE,Software Engineer," Proficient solving algorithms challenges that involve data structures. Partner with multidisciplinary teams (Technical Writing, User Experience, Product..."
Hewlett Packard Enterprise,Environment Health Safety Expert, Advanced degree in related science field preferred. First level university degree in related science field recommended;...
amdocs,Solution Architect, Degree in Computer Science or Industrial Engineering &amp; Management - Information Systems. You will join the Amdocs Solution Architects community and participate...
Bosch Group,Embedded Software Team Leader," Electronics, Software Engineer, Computer Science, etc.). Metrics / data collection, analysis for the project and status reporting...."
amdocs,Software Engineer (Java) Graduate," From virtualized telecommunications networks, Big Data and Internet of Things to mobile financial services, billing and operational support systems, we are..."
amdocs,Network Specialist," Bachelor’s degree in Computer Science, Engineering, or equivalent experience required. From virtualized telecommunications networks, Big Data and Internet of..."
CalAmp,"Senior Quality Engineer, Supplier Quality (Mexico)", Ensure proper Quality data reporting to customer database/portal. BS Engineering (Electrical or Computer Science preferred)/ An associate's degree or other...
Oracle,Applications Developer 3," Intermediate level knowledge of Data Analytics, WebServices and other integration methodologies. Intermediate level knowledge of incorporating Chatbots,..."
Kueski,Back End Engineer, Solid foundation in computer science. Integrate with third party APIs to access external data. BS/MS/PhD in Computer Science or equivalent from top tier school....
Accedo,"Senior Software Engineer - Web (JavaScript), Guadalajara"," Degree in Computer Science, Software Engineering, IT or related discipline. Strong knowledge of data structures and algorithms to solve complex problems..."
Scalable Press,Product Manager," Experience managing large amounts of data. Bachelors degree(preferably in a technical discipline, such as computer science, engineering, math, or economics)...."
Jabil Circuit,Test Engineer III, Bachelors of Science in Electronics or Electrical Engineering. Compile and document data necessary to analyze performance and make recommendations for changes...
Bosch Group,Front End Developer," Familiarity with Data Analytics. Bachelor’s or Master’s degree in computer science, software engineering, or similar, or equivalent work experience in an..."
Oracle,Principal Development Operations (DevOps) Engineer," The applications will use data from Oracle’s Data Cloud, social media and other sources to drive automated outcomes in a number of horizontal and vertical..."
Oracle,CX Cloud - Senior Support Engineering Consultant," Excellent knowledge of the Fusion CRM data model. University degree in either Engineering (Production or Mechanical), Math’s, Economics, Computer Science or..."
Oracle,Senior Applications Engineer (AI / ML)," Oracle Adaptive Intelligent Apps is the next generation of business applications, using big data from multiple sources, combined with Machine Learning and state..."
HP,Strategic Development Manager, Works on complex problems where analysis of situations or data requires an in-depth evaluation of multiple factors....
NTT,SAP-FICO Consultant," NTT DATA, Inc. About NTT DATA Services. Bachelors in Computer Science or equivalent work experience. At NTT DATA Services, we know that with the right people on..."
Intel,Linux Security Developer Engineer," Degree in Computer Science, Electrical Engineering, Computer Engineering, or other related engineering disciplines with Proven work experience as software..."
Synechron Inc.,QA Automation Tester," Responsible for creating test data based on the requirements. Bachelor's Degree in Computer Science, Management Information Systems, or related...."
"Arrow Electronics, Inc.","Senior Web Developer, Frontend"," Bachelor’s Degree in Computer Science, MIS, Math, Engineering or equivalent technical experience. Ability to prove prior experience integrating multiple data..."
Intel,Senior Software Developer," Bachelors in Computer Science or equivalent is required, Master in Computer Science is a plus. The data center is the underpinning for every data-driven service..."
amdocs,Software Engineering Manager," From virtualized telecommunications networks, Big Data and Internet of Things to mobile financial services, billing and operational support systems, we are..."
Oracle,.Net Developer," Experience with ADO.net data providers. Typically requires a BS/MS in computer science from University. As a member of the MySQL software engineering division,..."
Reclutaenlinea,Back End Engineer para FINTECH," Solid foundation in computer science, with strong competencies in data structures, algorithms and software design optimized for embedded systems...."
"Magic Leap, Inc.",Quality Engineer," Conduct data collection and management in support of DOEs. BS engineering degree in Mechanical, Materials Science, Optics, or Controls...."
NXP Semiconductors,Solutions Web Manager," BS Electrical Eng., Computer Science. Aggregate weekly, monthly and quarterly data from various sources. Learn and utilize a number of web tools to publish and..."
Hewlett Packard Enterprise,Regional e-Service Portal Administrator and Automation Lead," Major in Computer Science or Computer coding experience is preferred. With the industry’s most comprehensive portfolio, spanning the cloud to the data center to..."
Kueski,Software Engineer Full-Stack, Solid foundation in computer science. Integrate with third party APIs to access external data. BS/MS/PhD in Computer Science or equivalent from top tier school....
NTT,SAP S/4 Finance Functional consultant," NTT DATA, Inc. About NTT DATA Services. Bachelors in Computer Science or equivalent work experience. At NTT DATA Services, we know that with the right people on..."
Propelics,SQL Server DBA," Understanding of data dictionaries and how data will flow through successive stages. Recommend strategies for data acquisition, archive recovery, and database..."
Open Market,Senior Network Engineer," Bachelor’s degree in Computer Science, Engineering, or equivalent experience required. Day-to-day operational support of a multi-site geo-redundant data center..."
Esprezza Concepto Humano,Desarrollador Net," Computer Science Engineer. Data base knowledges, scripting, RPA. C# Developer, Data Analysis, .Net Developer. 1 year as developer...."
Kueski,Sr. Software Engineer Front End, Solid foundation in computer science. Implement data visualization technologies to improve the information flow....
Intel,Sr. System Validation Engineer," In Electrical Engineering, Computer Engineering, or Computer Science. The data center is the underpinning for every data-driven service, from artificial..."
Emerson,Supplier Quality Engineer," Define problems, collect data, establish facts and draw verifiable conclusions. Good working knowledge of computers, data acquisition, and computer aided..."
Oracle,Senior DevOps Engineer," Drive platform maturity for multi-user collaboration and planning experiences, data pipes, data integrations, API services and other data distribution services...."
Plexus,Quality Engineer Il," Ability to apply knowledge, logic and reasoning using mathematics, statistics, science, and engineering applications...."
Bosch Group,Back End developer," BS degree in Computer Science, Engineering, or equivalent experience. Become a key partner to data scientists on solving technical challenges...."
amdocs,Java Support Engineer Sr.," From virtualized telecommunications networks, Big Data and Internet of Things to mobile financial services, billing and operational support systems, we are..."
"Barbachano International, Inc.",Sr. Applications Support Engineer," BS/MS in Electrical Engineering, Computer Science, or Related Field. You will enable customer specific customizations requiring advanced scripting, programming..."
Kueski,Software Engineer Back End, Solid foundation in computer science. Integrate with third party APIs to access external data. BS/MS/PhD in Computer Science or equivalent from top tier school....
amdocs,Java Support Engineer," From virtualized telecommunications networks, Big Data and Internet of Things to mobile financial services, billing and operational support systems, we are..."
amdocs,Java Developer," From virtualized telecommunications networks, Big Data and Internet of Things to mobile financial services, billing and operational support systems, we are..."
amdocs,Java / C++ Support Engineer," From virtualized telecommunications networks, Big Data and Internet of Things to mobile financial services, billing and operational support systems, we are..."
amdocs,Back-End Senior Java Developer," Computer Science, Web Development, Graphic Design, New Media, Engineering, Liberal Arts, etc.). From virtualized telecommunications networks, Big Data and..."
amdocs,Java Backend Developer," From virtualized telecommunications networks, Big Data and Internet of Things to mobile financial services, billing and operational support systems, we are..."
EPAM Systems,Java Developer/Algorithm Specialist," Strong competencies in data structures &amp; software design (Design Patterns). Solid foundation in computer science, with strong analytical thinking and ability to..."
EPAM Systems,Lead Java Developer," Solid foundation in computer science, with strong competencies in data structures, algorithms, and software design...."
AstraZeneca,Java Support Engineer," Master’s / Bachelor’s degree or equivalent in computer science. Proactive analysis, validation &amp; fixing of business data issues...."
EPAM Systems,Senior JavaScript Developer, BA/BS degree in Computer Science or related technical field or equivalent practical experience. Leverage user behavior data and A/B testing to better understand...
Synechron Inc.,Java Developer, Solid Java experience and data processing background. Solid design and programming with computer science related problem solving skill....
Dresden Partners,Desarrollador Python," Dresden Partners expertos en web technology, UX / UI, mobile and software development, con servicios near-shore staffing, tech international y local tech..."
Disforma,Jr. Software Developer," BS in Computer Science or equivalent. Strong competences in data structures, algorithms and software design. Jr...."
Presidency Solutions,Blockchain Software Developer Jr.," Knowledge of common algorithms and data structures. Bachelor's degree in computer science, information systems, or engineering to work as blockchain engineer...."
Skycatch,C++ and Python Developer," Degree in Computer Science. Drones with cameras, cameras on the field, LiDAR, and other sensors provide the data, while you will build the algorithms that can..."
Xperiencia Laboral,AUTOMATED QA TESTER," Bachelor´s degree in Computer Science, information, Technology, Computer Engineering or other related field. Strong hands-on experience in writing detailed test..."
Presidency Solutions,Hiring talented C++ Software Developer," Strong knowledge of common algorithms and data structures. Bachelor's degree in computer science, information systems, or engineering to work as blockchain..."
Xperiencia Laboral,Testing QA - Mobiles -ingles avanzado," Ability to monitor incoming data and introduce errors if needed. Bachelor's degree in Computer Science, Information Technology, Computer Engineering or other..."
Xperiencia Laboral,QA testing mobile - ingles avanzado," Ability to monitor incoming data and introduce errors if needed. Bachelor's degree in Computer Science, Information Technology, Computer Engineering or other..."
