company,job,summary
DANONE,Data Scientist Machine Learning & IA, Alors devenez Data Scientist Machine Learning &amp; Artificial Intelligence. Participer à un réseau externe dans le domaine du Machine Learning &amp; IA....
SWORD,Ingénieur d’études et Développement IA/Machine Learning," Pour accompagner notre client dans son projet lié à la banque et la finance, nous recherchons un Ingénieur d’études et Développement expérimenté dans l’IA..."
Criteo,"Sr. Software Engineer in Machine Learning, Engineering - Software Development", We are searching for great machine learning engineers to join the team responsible for extending Criteo's large scale distributed machine learning library (e.g....
Thales Group,Data scientist orienté recherche en machine learning (H/F)," Ceci en utilisant et développant des méthodes de machine learning, deep learning, théorie des graphes, etc. Vous êtes titulaire d’un bac+5 en école d'ingénieur..."
Sept Lieues,Machine Learning Engineer - H/F," En tant que machine learning engineer, vous travaillerez, avec l'équipe scientifique, dans un environnement dynamique et stimulant...."
DOGFINANCE,Datascientist / Machine Learning - Paris F/H," Statistique, Machine Learning (supervisé et non supervisé), R, Python SciKit Learn, SparkML,. Entreprise Dogfinance recherche pour le compte de son client..."
SEPT LIEUES,Machine Learning Engineer - Immobilier F/H," Participation aux réflexions avec les data scientist concernant les méthodes de Machine Learning utilisées. Vous travaillerez, avec l'équipe scientifique, dans..."
EUROGICIEL INGENIERIE,Ingénieur Deep/Machine Learning F/H," Profil recherché De formation Bac + 5 (école d'ingénieur ou universitaire) en développement logiciel, Machine Learning, ou équivalent (Université, Ecole d..."
Castelis,Ingénieur R&D - Machine Learning H/F, Utiliser les algorithmes de Machine Learning pour répondre à la problématique client en apportant solution et prédictions....
Criteo,Sr. Software Engineer in Machine Learning, We are searching for great machine learning engineers to join the team responsible for extending Criteo's large scale distributed machine learning library (e.g....
UiPath,Machine Learning Product Manager, Participate in research in artificial intelligence and machine learning applications. 2+ years of work or educational experience in Machine Learning or...
Google,"Software Engineer, Research and Machine Intelligence", Experience in Machine Learning or Artificial Intelligence. Participate in research for artificial intelligence and machine learning applications....
-,Stage Data Science / Machine Learning," Mots clés Machine Learning , Deep Learning , Reinforcement Learning. Stage Data Science / Machine Learning...."
craft ai,INGÉNIEUR(E) R&D MACHINE LEARNING (PHD)," Automated Machine Learning:. Excellence en Machine Learning,. Comment packager des algorithmes de Machine Learning avancés dans une API simple d'utilisation,...."
Planet Expat,Machine Learning Engineer / Lead NLP, We are recruiting a Machine Learning Engineer who will be fluent in machine learning and Natural Language Process algorithms to solve efficiently Natural...
craft ai,STAGIAIRE R&D MACHINE LEARNING," Passion pour le Machine Learning et l'Intelligence Artificielle,. Directement au coeur des problématiques d'IA et plus précisément de Machine Learning,...."
SKILL HUNTER,Remote PhD Machine Learning (Python) - éditeur Américain F/H," Le goût des développements bien conçus, bien exécutés, bien documentés, maintenables - Connaissance en Machine Learning...."
Atos,Doctorant Machine-Learning H/F," Dans cet objectif, Atos cherche à mettre en œuvre du « Machine Learning », dont les cas d’utilisations n’ont pas de frontière de métier...."
Parrot Drones,Ingénieur Software Deep Learning (H/F)," Outils de gestion de configuration (Git , Gerrit), Machine learning, Deep learning, Frameworks deep learning (Tensorflow, Caffe)...."
IKTOS STAGE,Stage Data Science / Machine Learning," En tant que stagiaire en Data Science / Machine Learning, vos responsabilités seront les suivantes:. Iktos est une start-up française au carrefour du deep..."
Sanofi,Post Doc - Statistics and Machine Learning (H/F)," State-of-the-art machine learning methods will be used such as, but not limited to, causality analysis, penalized regressions and bayesian networks...."
Galeries Lafayette - LE BHV MARAIS,Datascientist H/F, Développer et industrialiser les modèles de Machine Learning pour différents cas d'usages sur tout type de données....
Thales,Data scientist orienté recherche en machine learning (H/F)," Ceci en utilisant et développant des méthodes de machine learning, deep learning, théorie des graphes, etc. Vous êtes titulaire d’un bac+5 en école d'ingénieur..."
NOKIA,Machine Learning Expert, Excellent understanding of techniques and algorithms of Cognitive Systems / Artificial Intelligence / Machine Learning....
Internet Memory Research,Engineer Deep Learning," Strong background in machine learning with emphasis on deep learning approaches. Or engineer’s degree in Machine Learning, Data Mining, Statistics, Applied..."
NOKIA,Bell Labs : Math & Algorithms Researcher in Machine Learning," O Extensive familiarity with statistical learning theory, machine learning, optimization. O PhD in Machine learning, statistics, math, computer science,..."
Mairie de Paris,Apprentissage Data analyste avec orientation data science," Outils d’analyse de données (Machine learning, clustering),. Le Service de la Transformation et de l'Intégration Numériques (STIN) propose et conduit l'ensemble..."
Urban Linker,INGÉNIEUR DATA EN MACHINE LEARNING (H/F) | STAT-UP SPÉCIALISÉE DANS LE GAMING @PARIS, DESCRIPTIF DE LA SOCIETE Start-up spécialisée dans l'edtech développe des plateformes en mode SaaS de formation en ligne sous forme de quizz et de jeu. Le...
Safran,Ingénieur de recherche Machine Learning et Vision Artificielle H/F," De formation Bac+5 ou Doctorat en mathématiques appliquées, reconnaissance des formes, machine learning, vision artificielle, ......"
NOKIA,Data Visualization and Machine Learning Engineer, Passion for technology and learning on the job. The Data Visualization and Machine Learning Engineer will be part of the incubation teams and drives the...
Sophia Engineering,Ingénieur en Vision par Ordinateur et Deep Learning (H/F)," Algorithmes (d’analyse, de traitement, de détection, d’apprentissage, etc…) Statistiques, Analyse Prédictive, Deep Learning, Machine Learning…...."
Snips,Computational linguist / Language Engineer," You will work with two senior Computational Linguists, in close collaboration with our Product, Engineering and Machine Learning teams...."
Skill Hunter,Remote phd machine learning (python) - éditeur américain," Cloud Computing, Machine Learning, Architecture scalable, calcul parallèle (HPC). Le goût des développements bien conçus, bien exécutés, bien documentés,..."
Matcha,DATA SCIENTIST JUNIOR," Bonne expérience en Machine Learning, sur des projets académiques et/ou personnels. Modéliser, prototyper et développer des modèles de Machine Learning / Deep..."
Manomano,Senior Data Scientist / Machine Learning Engineer (H/F)," Une ou plusieurs expérience(s) significative(s) de Machine Learning en production,. Supervised &amp; Unsupervised learning,...."
MP DATA,Data Scientist Computer Vision - Deep Learning F/H," Vous avez des connaissances en computer vision et machine learning (deep learning, random forest, svm...). Dans le domaine du ferroviaire, vous concevrez un..."
Google,Collaboration dans le domaine de la recherche pour étudiants," Pour y parvenir, nous travaillons sur des projets qui exploitent les dernières techniques de machine learning (notamment les approches de deep learning comme..."
Criteo,"Research Scientist, Research", This is truly big data and machine learning without the buzzwords. PhD in Machine Learning or a related field along with at least five years of experience....
FISH EYE TECHNOLOGIES,Ingénieur en Computer Vision Machine Learning F/H," Computer Vision, Image Processing, Machine Learning, Deep Learning. Ingénieur en Computer Vision et Machine Learning...."
Publicis Media,CDI - Data Scientist Junior (H/F), Exploiter ces données notamment avec des algorithmes de Machine Learning. Vous êtes passionné(e) par les algorithmes de Machine Learning et par la Data Science...
Dassault Systèmes,STAGE – Ingénieur Recherche en Vision par Ordinateur et Machine Learning : Nouveaux ...," Mathématiques appliquées, Vision par Ordinateur, Machine Learning. Vous travaillerez sur les techniques de Vision par Ordinateur et Machine Learning pour la..."
Dassault Systèmes,STAGE - Ingénieur Recherche - Incremental Machine Learning (H/F), Les algorithmes de Machine Learning sont devenus très populaires ces dernières années. Nous proposons au cours de ce stage d’explorer les techniques de Machine...
Dassault Systèmes,STAGE - Data Scientist - Representation Learning (H/F)," Python, pratique du machine learning et du deep learning. Identifier et tester des usages de technologies de machine learning a valeur ajoutée dans ces..."
AXA,Chargé de projet Machine Learning - CDD 12 mois F/H," IOT, Chatbot, Machine Learning, Deep Learning, Data Science, IA,…. Piloter l’exécution de pilotes/projets innovants liés au Machine Learning...."
BNP Paribas Securities Services,ASSISTANT PROJET – LEARNING & DEVELOPMENT H/F, Ce programme utilise des nouvelles technologies de type intelligence artificielle (AI) et Machine Learning (ML) pour réinventer nos métiers....
Winamax,ChatBot Betting pour les messengers, IA / Machine Learning. L’objectif de ce sujet de stage est de créer un chatbot (eg Facebook) permettant à l'utilisateur d'interagir avec la base de données de...
Dailymotion,"Senior Data Scientist / Machine Learning Expert, Ad Tech (M/F)", Job Description Make a huge impact for dailymotion by joining our team as a Data Scientist. You will be responsible for building models to make data-driven...
Crédit Agricole CIB,Machine Learning and Market Risk Analyst on atypical transactions H/F," Travailler sur le projet Machine Learning. Compétences Machine Learning/Data Scientist (HADOOP, PYTHON) ; En complément, vous travaillerez aussi sur le projet..."
"Samsung Semiconductor, Inc.",Software Engineer - Artificial Intelligence Labs Paris," Au contact de de l’équipe, vous renforcerez vos connaissances en développement mais aussi autour des technologies de Machine Learning...."
JCDecaux FR,Stage - Data Scientist Machine Learning - Mai/Juin 2018 H/F," Algorithmie et Machine Learning avec sujet de thèse / mémoire dans ce domaine. Expérience dans la Machine Learning distribué, sur un cluster de AWS / Google /..."
Thales Group,Ingénieur(e) R&T en deep learning (H/F)," Vous travaillerez au sein d'une équipe pluridisciplinaire mêlant des spécialistes en développement logiciel, des spécialistes des plates-formes de traitement,..."
EY,Consultant débutant en Analytics H/F," Programmation d’algorithmes prédictifs (scoring, segmentation, Machine Learning,…),. Intégrées dans les pays de la zone EMEIA, les activités du département FSO ..."
Testapic,function searchDataDeveloper," D'accompagner les ingénieurs DATA dans leurs missions (Qualification, Enrichissement, AI, Machine learning, ...),...."
Sept Lieues,Data Engineer - Machine Learning," Startup en forte croissance, spécialisée en intelligence artificielle. LE POSTE / LES MISSIONS Vous rejoindrez l'entreprise en tant que data engineer au sein..."
Sept Lieues,Machine Learning Engineer - Immobilier, Participation aux réflexions avec les data scientist concernant les méthodes de Machine Learning utilisées....
Sept Lieues,Machine Learning Engineer - IA," En tant que Spark ou Python Machine Learning Engineer, vous développerez sous Spark ou Python et vous serez le point de référence de votre équipe, en ce qui..."
Planorama,Research Scientist – Image Recognition," Good skills in machine learning:. Supervised or unsupervised artificial neural networks (deep learning) and/or SVM, random forest…...."
Ivalua,Ingénieur Machine Learning H/F," Pour renforcer notre équipe IA, nous recherchons des Ingénieurs en Machine Learning capables d'implémenter des algorithmes et d'entraîner des modèles d..."
Groupama,Datascientist H/F," Construction des modélisations et machine learning permettant de détecter les signaux faibles liés à la navigation on line et détecter des moments de vie,..."
BNP Paribas Corporate & Institutional Banking,DATA SCIENTIST / AI LAB," Vous avez des compétences poussées en Machine Learning :. Oui, si vous êtes diplômé(e) d’un Bac+5 en Ecole d’Ingénieur ou équivalent universitaire avec une..."
Justice.cool,DATA ENGINEER / DÉVELOPPEUR (IA APPLIQUÉE À LA JUSTICE), L'implémentation des modèles Machine Learning et des jobs d'apprentissage. La collaboration avec l'équipe production pour intégrer les méthodes Machine Learning...
Winamax,Skill Alexa pour le Betting, IA / Machine Learning. L’objectif de ce sujet de stage est de développer un Chatbot vocal (e.g....
Bouygues Telecom,Stage Testing et Deep Learning H/F," La connaissance d'algorithmes de Machine Learning / Deep Learning, d'API Restful ou du language Python et de ses librairies de Machine Learning serait un plus...."
Google,Student Research Collaboration, Participate in cutting edge research in machine intelligence and machine learning applications. Experience (classroom or work related) in Natural Language...
Sept Lieues,Développeur Machine Learning," Vous rejoindrez l'entreprise en tant que développeur machine learning. A ce titre, vous développez, implémentez et maintenez les algorithmes de Machine Learning..."
Abc Arbitrage,Ingénieur financier recherche quantitative (h/f)," Arbitrage statistique, pricing de produits dérivés, microstructure de marché, probabilités et statistiques, big data, programmation, traitement du signal,..."
Kpler,Front," Our team is made of 25 engineers in fond of data who are experts in machine learning and data science. By joining our agile and fast-growing team, you will..."
Google,Chercheur, Vous participez à la recherche de pointe dans le domaine de l'intelligence artificielle et du machine learning....
Google,Research Scientist," Participate in cutting-edge research in machine intelligence and machine learning applications. Experience in Natural Language Understanding, Computer Vision,..."
1000mercis,Assistant(e) Data Scientist," De formation supérieure bac +5 (masters, écoles d'ingénieurs…), spécialisation en mathématiques appliquées, compétences en algorithmique et machine learning...."
IBM-Interactive,Consultant junior Analytics F/H," Une forte expérience dans la data science (Méthodes statistiques avancées, apprentissage non-supervisé, classification supervisée, analyse prédictive, machine..."
Winamax,Moteur de recherche Betting, IA / Machine Learning. L’objectif de ce sujet de stage est de developer un moteur de recherche permettant :....
GoPro,Embedded Computer Vision & Image Quality Algorithms Engineer," Minimum 2 years of work experience in Image Quality, Computer Vision and Machine Learning; The position will be involved in the Research &amp; Development of..."
Keecker,Back-end Developer," Analytics, Machine Learning... Keecker est une startup qui développe le premier robot média au monde, pour simplifier la technologie dans la maison:...."
Justice.cool,DÉVELOPPEUR FULLSTACK (START-UP DE LA LEGALTECH)," En collaboration avec nos data scientists, tu auras également l'occasion de découvrir (ou d'approfondir tes connaissances) le machine learning et l'IA...."
Criteo,Research Scientist, This is truly big data and machine learning without the buzzwords. PhD in Machine Learning or a related field along with at least five years of experience....
CA CIB FRANCE,Machine Learning and Market Risk Analyst on atypical transactions H/F," Travailler sur le projet Machine Learning. Compétences Machine Learning/Data Scientist (HADOOP, PYTHON) ; En complément, vous travaillerez aussi sur le projet..."
Brand And Celebrities,Bras droit CEO," Big data, algorithmes de matching, R&amp;D et machine learning sont au cœur du développement de Brand and Celebrities. A propos de Brand and Celebrities...."
Entrepreneur First,Programme d’Accélération Startup," 140 startups ont été lancées par EF, pour une valorisation totale d'environ $1 milliard, et dans des domaines aussi divers que la fintech, la healthtech, les..."
Harnham,Head of Data Science and Machine Learning, Head of Data Science &amp; Machine learning. Experience in research and industrial Machine learning is essential....
Réseau de transport d'électricité,Estimation temps réel de production photovoltaïque à partir d'image satellite - H/F, Lieu : Durée et/ou période du stage : L’électricité qui circule sur le réseau haute et très haute tension de RTE fait vibrer l’économie. Elle alimente les...
Valeo Türkiye,CHERCHEUR EN MACHINE LEARNING/ TRAITEMENT DE SIGNAL & ROBOTIQUE H/F," PhD in Machine Learning, Signal Processing/Robotics, with strong publication record. Push state-of-the-art in computer vision, deep learning and reinforcement..."
Blue Ridge Logiciels,STAGE DÉVELOPPEMENT DE MÉTHODES DE MACHINE LEARNING POUR LE TRAITEMENT 3D POUR L'INDUSTRIE DE LA CHAUSSURE h/f Paris," En formation en informatique ou mathématiques appliquées, avec une spécialité en traitement d’image, traitement du signal, machine learning ou sciences..."
Sightengine,Artificial Intelligence - Scientist," You have hands-on experience with Deep Learning, Machine Learning and/or Image Processing. Stay at the forefront of advances in Deep Learning...."
Fidel Technologies,Researcher, You continually seek to remain up to date with the state-of-the-art in machine learning and related fields. We provides insurance companies with an innovative...
Angus.ai,COMPUTER VISION INTERN," Familiar with advanced machine learning approaches. Having worked with machine learning libraries (theano, pylearn, lasagne, etc…) is a big plus...."
-,Ingénieur(e) R&T en deep learning (H/F)," Réglementaire , Applied Mathematics , Laboratory , BDD , ALGORITHMIE Voir plus Software Development , C / C++ , Traitement de l'image , Transport , Sécurité ,..."
Facebook,Research Scientist (AI)," Individuals in this role are expected to be recognized experts in identified research areas such as artificial intelligence, machine learning, computational..."
EY,Consultant Data Scientist Débutant H/F," Exploration et mise en qualité des données, data management, analyses descriptives, implémentation de modèles statistiques et/ou économétriques (scores,..."
Google,"Research Scientist, Google Brain", Participate in cutting edge research in machine intelligence and machine learning applications. From creating experiments and prototyping implementations to...
APEC,CHARGE.E DE MISSIONS SEMANTIQUE F/H," Au sein du service Développements et Maintenance et rattaché.e au Responsable du service, vous intégrez l'équipe en charge de développer les fonctionnalités,..."
Doctrine,VP Sales," In 2018, Doctrine ambition is to build the most efficient sales machine ever. We are looking for an experienced VP Sales with a metrics oriented mindset who..."
LOKAD,Junior Supply Chain Scientist," Except that you're dealing with Big Data and Machine Learning through the use of Lokad's platform. As a Supply Chain Scientist, your role is to make sure our..."
Azeo Talents & Technology,Consultant junior BI-SQL Server (H/F)," Des connaissances en statistiques, Machine Learning ou en Hadoop sont des atouts. Modélisation décisionnelle et mise en place de solutions BI\Big Data\Machine..."
craft ai,DATA SCIENTIST," Alignement avec la vision produit (SaaS, Automated Machine Learning, Explainable AI) de craft ai,. Connaissance pratique des algorithmes de Machine Learning..."
SoBus,INGÉNIEUR ALGORITHMIE," Data science, algorithme, API, scrapping, donnée, machine learning. Enfin nous voulons que le tri des résultats soit le plus pertinent possible, en fontion du..."
L'Olivier Assurances,Chargé d'études statistiques, Vous commencerez des projets de machine learning. Pourquoi nous rejoindre ?...
OUI.sncf,Data Scientist (H/F)," Maîtrise des modèles statistiques, d’économétries, et de machine Learning. Utiliser des algorithmes basés sur des techniques de statistique ou de machine..."
Google,"Chercheur, Google Brain", Vous participez à la recherche de pointe dans le domaine de l'intelligence artificielle et du machine learning....
Groupe Onepoint,Craftswoman/Craftsman," Tu as déjà eu l’obligation d’orchestrer tes réalisations en tenant compte des clouds hybrid groupe, des projets bigdata en cours, des tentatives de valorisation..."
Google,"Research Scientist, Perception, Google AI"," Experience in Computer Vision, Machine Learning and Deep Learning. Machine perception has made significant progress over the past decade...."
Facebook,Visiting Scientist (AI), Academic publications in the field of machine learning. Individuals in this role are expected to be recognized experts in identified research areas such as...
Dassault Systèmes,"STAGE - Ingénieur Recherche, Machine Learning pour DevOps (H/F)"," Machine Learning &amp; DevOps. Expérience de développement sur des frameworks de Machine Learning. Mathématiques Appliquées, Apprentissage Statistique, Réseaux de..."
1000mercis,Data Scientist, Excellent machine learning and applied maths skills. Numberly® is looking for a Data Scientist to work on applied mathematics and machine learning projects and...
SORBONNE UNIVERSITE,Postdoctorant en imagerie génétique /Postdoctoral on Imaging Genetics F/H," PhD in bio-/Statistics, Computer Science, Machine Learning, Electrical Engineering or related fields, with research experience in statistical machine learning..."
MFG Labs,Data Scientist, Strong analytical skills (statistics + machine learning + programming). Apply sound statistical and machine learning techniques to help inference and decision...
Criteo,"Junior Software Engineer, Engineering - Software Development"," This is truly big data and machine learning without the buzzwords. You can ask questions and participate in all knowledge sharing sessions/workshops, etc. You..."
IQVIA,Project Leader, Knowledge in big data analytics and machine learning. Join us on our exciting journey!...
Altelios Technology,Ingénieur Vision par ordinateur (H/F), Formation ingénieur avec spécialisation en Machine learning ou computer vision ou doctorat en computer vision - 3 à 10 ans d'expérience....
Quantmetry,NOS OFFRES," Experts en statistiques, machine learning et analyse quantitative, les data scientists sont aussi d'excellent programmeurs...."
Facebook,Research Intern (AI)," Experience building systems based on machine learning and/or deep learning methods. We are seeking individuals passionate in areas such as deep learning,..."
365Talents,Customer success consultant," Grâce à nos algorithmes de machine learning et d’analyse du langage naturel, notre plateforme révèle en temps réel les compétences des collaborateurs quelles qu..."
Priceminister,Applied Research Scientist – Immersive Interactions M/F," RIT is a unique environment for scientific research and innovations in the domain of Human-Computer Interactions, Computer Vision, Natural Language Processing,..."
Navya,Ingénieur Cartographie H/F," Des expériences en Python, GIT/SVN, CMake, RTMaps, ROS, PCL, GPGPU, Machine Learning, et Anglais seraient un plus. Ingénieur Cartographie H/F...."
Google,"Chercheur, Perception, Google AI"," Expérience dans le domaine de la vision par ordinateur, du machine learning et du deep learning. Chez Google, nous avons une approche toute particulière de la..."
Brand And Celebrities,Bras droit du Directeur du Pôle Celebrity Management (H/F)," Big data, algorithmes de matching, R&amp;D et machine learning sont au cœur du développement de Brand and Celebrities qui ambitionne de devenir le leader mondial en..."
Facebook,"Postdoctoral Researcher, AI (PhD University Grad)"," Individuals in this role are expected to be recognized experts in identified research areas such as artificial intelligence, machine learning, computational..."
Neoxia,Data Engineer/Scientist H/F," Mission Au sein de la team DATA de Neoxia, tu travailleras sur des projets en lien direct avec la stratégie numérique de nos clients. Ton champ d'action..."
Margo Conseil,Data Scientist," Vous êtes issu(e) d’une grande école d’ingénieur et /ou titulaire d’un PhD en Machine Learning. En parallèle de ce poste, vous assurez une veille technologique..."
The Price Hub,Stagiaire Data Scientist," Algorithmes de Machine Learning supervisés ou non (forêts aléatoires, SVM, réseaux de neurones…). Aux côtés de notre data scientist, vous aurez à :...."
BNP Paribas Corporate & Institutional Banking,ANALYSTE QUANTITATIF," Tests de nouveaux algorithmes de machine learning. Oui, si vous êtes diplômé(e) d’un BAC+5 en école d’ingénieur ou école de statistiques, Master de..."
Google,"Software Engineering Intern, Research, 2018", Participate in cutting edge research in machine intelligence and machine learning applications. Experience (classroom or work related) in Natural Language...
KissKissBankBank,Développeur.se front, Nous cherchons aujourd'hui à renforcer notre équipe technique avec un profil front pour accélérer la refonte de l’UX de nos plateformes et moderniser notre...
