company,job,summary
Google,"Ingénieur(e) logiciel, Recherche et intelligence artificielle", Expérience du machine learning ou de l'intelligence artificielle. Participer à la recherche dans le domaine des applications de l'intelligence artificielle et...
Autorité de régulation des activités ferroviaires,Economiste / Data scientist," Compétences en capture et traitement de données web statiques et dynamiques (API), notions de « machine learning », connaissance des problématiques de..."
C3 IoT,Data Scientist," Connaissance approfondie des techniques de Machine Learning (régression, séries temporelles, modèles probabilistes, apprentissage supervisé et non-supervisé,..."
"Samsung Semiconductor, Inc.",Computer Vision Engineer, Très bonnes connaissances en traitement d’images et en Machine Learning appliqué à l’image. Ces projets auront pour but de résoudre un problème concret ou de...
InnoValeur,DATA SCIENTIST," Vous avez une bonne connaissance en réseaux de neurones, intelligence artificielle, machine learning, et apprentissage supervisé et non supervisé...."
Inria,PostDoc / Computer Vision for autonomous driving," Computer vision, machine learning. Computer vision, mobile robotics, or machine learning. PhD in either Computer Vision or Machine Learning...."
Luko,DATA SCIENTIST / ARTIFICIAL INTELLIGENCE," Step by step you will Lead Machine Learning on one of our challenge challenges (ex :. Experience in computer vision, Deep Learning, Theano, Tensorflow, Caffe or..."
Brand And Celebrities,Communication Manager (H/F)," Big data, algorithmes de matching, R&amp;D et machine learning sont au cœur du développement de Brand and Celebrities qui ambitionne de devenir le leader mondial en..."
Facebook,"PhD Student, CIFRE (AI)", Knowledge in Machine Learning. Experience building systems based on machine learning and/or deep learning methods....
MYDRAL,Data Scientist (H/F), Développer des algorithmes et des régressions logistiques de Machine Learning ; Utiliser des méthodes ML adaptées aux grosses volumétries (out-of-core online...
Urban Linker,REACT DEVELOPER IN DEEP LEARNING X ARTIFICIAL INTELLIGENCE (FOR LUXURY INDUSTRY)," Today, there is one team aimed for research and development in machine learning (Python / Elastic Search)...."
AXA,Ingénieur en Datascience – Développement Expertise Catastrophes Naturelles - (F/H)," Connaissances avancées en probabilité, statistiques et machine learning. Le Groupe AXA , un des leaders mondiaux de la Protection Financière, accompagne et..."
Dentsu Aegis,Stage - Data Analyst en Machine Learning H/F, Machine learning &amp; Big Data :. Vous maîtrisez les techniques statistiques de machine learning et les approches datamining liées au big data....
Criteo,"Software Engineer - Algorithms, Engineering - Software Development", This is truly big data and machine learning without the buzzwords. Our engineers develop industry leading machine learning techniques working on feature...
Shift Technology,Data Scientist (DE)," You have advanced technical skills in Applied Mathematics, preferably in machine learning and/or operations research;..."
CGI,Consultants et Architectes Big Data - H/F," Big Data et Machine Learning. Également, vous devez appréhender les nouveaux concepts adossés au terme Big Data (Data visualisation, Machine Learning, Real Time..."
Planet Expat,Artificial Intelligence Solutions Engineer," Founded in 2016, we have been growing fast and are now a team of 12 people that includes experts in Machine Learning, Artificial Intelligence, Data Scientists..."
UGoMap,Responsable de la commercialisation de A à Z," Je travaille sur le développement de la carte depuis presque un an sur tous les aspects (cartographie, design, programmation front-end, back-end, image..."
C3 IoT,Software Engineer - Applications," En proche collaboration avec les équipes Machine Learning et Data Science, nos développeurs travaillent finalement à l'intégration d'algorithmes d'apprentissage..."
Quantmetry,R&D, Quelle transparence pour les algorithmes d&amp;#39;apprentissage machine ? High-throughput ovariance follicle counting by an innovative deep learning approach....
Criteo,Junior Software Engineer," This is truly big data and machine learning without the buzzwords. You can ask questions and participate in all knowledge sharing sessions/workshops, etc. You..."
-,ENGAGEMENT MANAGER – ESN -PARIS LA DEFENSE," Modélisation de nouveaux produits financiers, gestion des risques, modèles d’optimisation d’allocation des fonds propres, algorithmes de « machine learning »…...."
IT link,Ingénieur commercial junior F/H," Détecter et qualifier les opportunités SaaS, Big Data, IoT, Machine Learning. Rattaché à la Direction Commerciale, tes missions sont les suivantes :...."
SDL,Software Tester," Opportunity to input to the Machine Learning. Machine leaning testing or development (Preferable. Full-time, on-site in the client office in Italy,...."
KPMG,Junior Technology Transformation," Avec 50 consultants en France et un réseau mondial de 3500 personnes, notre équipe Data Analytics accompagne des grands comptes internationaux dans leurs..."
OUI.sncf,Développeur ReactJS (H/F)," Solution Big Data pour le calcul des prix et stockage scalable (machine learning avec Spark, indexing avec Elastic Search, API Java 8, Scala et influxDB)...."
Malakoff médéric,ALTERNANT - Data Scientist H/F, Vous avez une première expérience en data science et en particulier du machine learning. Malakoff Médéric est un acteur majeur de la protection sociale...
L’olivier – assurance auto,Chargé d'études statistiques F/H, Vous commencerez des projets de machine learning. Pourquoi nous rejoindre ?...
Extia,Data Scientist H/F," Nouvelles avancées en machine learning (notamment en deep learning). Au sein d'une équipe de Data Scientist, vous accompagnez nos clients dans des projets d..."
Sightengine,Artificial Intelligence - Developer / Engineer," You have a degree or experience related to Computer Science, Machine Learning and/or Image Processing. Become a Sightengine master...."
KissKissBankBank,Développeur.se back, Nous cherchons aujourd'hui à renforcer notre équipe technique avec un profil back pour participer au design de notre plateforme d'APIs et au refactoring de...
13/08/2018,Data Scientist F/H," Ingénieur(e) de formation, spécialisé(e) en data science et en machine learning, seront attendus de votre part rigueur, aisance relationnelle, un fort esprit d..."
Criteo,Software Engineer - Algorithms, This is truly big data and machine learning without the buzzwords. Our engineers develop industry leading machine learning techniques working on feature...
Fidel Technologies,Data Scientist," Advanced technical skills in Applied Mathematics, preferably in machine learning and/or operations research. We provides insurance companies with an innovative..."
C3 IoT,Customer Success Engineer," The candidate must demonstrate an interest in advancing their career in application development, machine learning, data integration and consulting...."
Criteo,Junior Incident Engineer," We are talking about BIG data, machine learning and performance. This is truly big data and machine learning without the buzzwords. Who we are...."
Generali France,Data scientist H/F," De formation supérieure spécialisée en Data science / Big Data, vous justifiez d’un première expérience vous ayant permis d'éprouver des méthodes de Machine..."
Google,"Stagiaire en ingénierie logicielle, Recherche, 2018"," Expérience (scolaire ou professionnelle) dans la compréhension du langage naturel, les réseaux neuronaux, la vision par ordinateur, l'apprentissage automatique..."
Criteo,"Junior Incident Engineer, Engineering - Site Reliability"," We are talking about BIG data, machine learning and performance. This is truly big data and machine learning without the buzzwords. Who we are...."
KRDS Paris,Développeur Back-End," Vrai intérêt pour le machine learning. Une fois familier avec les différentes solutions de NLP, vous participerez au développement d’un outil de machine..."
Splunk,ITOA Specialist - South Region," A thorough understanding of Dev Ops, Machine Learning in Dev Ops and AI Ops coupled with Machine Learning to help unify our solutions and overall go to market..."
SCOR,Data Scientist, The R&amp;D Center lately launched many Machine Learning projects on Text Mining and survival analysis. You will support the establishment of the global data...
Scibids,DATA SCIENTIST," WHAT YOU WILL DO The mission of Scibids is to provide to media buyers fully automated buying strategies for display campaigns, bringing the best performances..."
MFG Labs,Data Analyst," Experience with machine learning. Basic knowledge of popular machine learning algorithms. The candidate will be part of our cross-talent team, working closely..."
Dassault Systèmes,STAGE - Ingénieur - Deep learning appliqué à la saisie d’objets virtuels 3D (H/F)," Connaissances et pratique des techniques de deep learning / machine learning. Informatique / Développement, Simulation, 3D, Machine Learning...."
BearingPoint,HyperCube - Stage en développement pour une solution de datamining / machine learning (H/F), Les consultants de BearingPoint savent que l’environnement économique change en permanence et que la complexité qui en découle nécessite des solutions...
MP DATA,Data Scientist Aéronautique Junior F/H," Profil recherché De profil ingénieur Grande Ecole (Centrale, Mines, Supaero, Supelec, ...), vous avez de bonnes connaissances en Machine Learning (Random Forest..."
Uniware,DATASCIENTIST / Freelance, Développeuse - Développeur cognitif expérimenté-e (agent conversationnel chatbot nlp machine learning). Vous avez à minima une connaissance théorique des...
General Electric,CDI - Responsable Programme Commercial H/F," Strong knowledge of learning techniques, innovative training solutions. GE est le groupe industriel numérique mondial, qui transforme l’industrie grâce à des..."
Criteo,Sr. Network Engineer, This is truly big data and machine learning without the buzzwords. Who we are....
Dir de la Banque des Territoires,Data scientist H/F, De formation supérieure en mathématiques appliquées (bac+5) avec une spécialisation en Machine Learning :....
Brand And Celebrities,Celebrity Manager France (h/f)," Big data, algorithmes de matching, R&amp;D et machine learning sont au cœur du développement de Brand and Celebrities qui ambitionne de devenir le leader mondial en..."
CAPFI,Data Scientist," Modélisation statistique par des techniques de Machine Learning, Deep Learning,... Nous répondons aux enjeux analytiques des Directions Marketing, Digital,..."
UCPA,DÉVELOPPEUR CLOUD," Faire partie de l’aventure innovante du sport connecté (Communautaire, Réseaux sociaux, Marketplace, IoT, Machine Learning). UCPA Siège Paris...."
craft ai,STAGIAIRE DATA SCIENTIST," Culture technique et métier, notamment autour du Machine Learning et de l'Intelligence Artificielle,. WHAT YOU WILL DO...."
NOKIA,Optical research PhD student," (Optionnel) quelques connaissances de base en électronique, machine learning et/ou transmission optique seront les bienvenues...."
Scibids,SOFTWARE ENGINEER," Parallel systems,information retrieval,machine learning, developing large software systems. WHAT YOU WILL DO...."
Doctrine,Data Scientist," A good knowledge of machine learning. Design and build customized, large-scale cloud-based machine learning systems...."
Google,"Software Engineering Intern, PhD 2018"," Contribute to a wide variety of projects utilizing natural language processing, artificial intelligence, data compression, machine learning and search..."
LOKAD,Intern in software development, As an intern in software development at Lokad you will help us to design and implement our Big Data apps. Lokad is seeking young passionate software developers...
AccorHotels,Data Manager H/F," Proposer des options et une réponse la plus adaptée au besoin (reporting, machine learning, segmentation, scoring, analyse textuelle...)...."
Angus.ai,COMPUTER VISION DEVELOPER (PHD)," Familiar with advanced machine learning approaches. Having worked with machine learning libraries (theano, pylearn, lasagne, etc…) is a big plus...."
Splunk,HR Consultant (Employee Relations), You will develop and deliver training modules in conjunction with our Learning and Development team. Join us as we pursue our disruptive new vision to make...
Ubisoft,EMEA Business Analyst H/F, Assurer l’applicabilité opérationnelle des outils de Machine Learning et participer à l’amélioration des modèles....
Pretty Simple,Data Engineer, Exposure to machine learning techniques. Build and put into production machine learning models. We are looking for a skilled Data Engineer to work on our...
General Electric,CDI - Analyste Données (Data Analyst) H/F," GE est le groupe industriel numérique mondial, qui transforme l’industrie grâce à des machines contrôlées par logiciel et des solutions connectées, adaptées et..."
AXA,Research Data Scientist - Internship - (F/H), Many machine learning models are black-boxes:. Interpretability of machine learning models is an important topic to develop the use of machine learning in...
Natixis,Maîtrise d’œuvre junior Back Office Dérivés (H/F), Big Data et Machine Learning. La DSI de Natixis est au cœur des enjeux stratégiques de Natixis pour développer de nouveaux services &amp; usages clients et adapter...
-,Ingénieur(e) de développement en apprentissage machine et intelligence artificielle (H/F)," Javascript , Design patterns , Systèmes d’informations , Laboratory , Programming Voir plus Statistics , Programmation web , Html , Python , Développement d..."
Criteo,"Software Engineer for Advertiser Platforms, Engineering - Software Development", This is truly big data and machine learning without the buzzwords. Our engineers develop industry leading machine learning techniques working on feature...
BLABLACAR,Product Manager," Improve matching and unlock millions of additional rides thanks to machine learning, transform the business model to make it scale in all geographies, implement..."
GoPro,Sensor Fusion Algorithms Engineer (State Estimation)," Interface with hardware and software engineers, integration, computer vision &amp; machine learning teams. State Estimation / Sensor Fusion Algorithms Senior..."
Greenflex,Data Analyst stagiaire (H/F), O Recherche et développement sur les applications de machine learning et de modélisations statistiques spécifiques aux besoins clients....
Nexton Consulting FR,Data Scientist," Machine learning, R, python (pandas, SCIKIT-Learn). Réaliser les développements en machine learning requis ou être capable de les proposer de manière proactive...."
Meritis,Data Scientist (H/F)," Analyser les besoins métier (use case) et proposer des supports de présentations (analyse explo, prediction, machine learning)...."
ITL France,Analyst - Data Science," Develop statistical, machine learning or optimization models independently for low complexity projects and with appropriate guidance for medium &amp; high..."
Engie Digital,ENGIE Digital - Data Scientist (H/F), Vous maîtrisez idéalement des frameworks de Machine Learning sur le cloud (AWS ML ou Azure ML). Vous travaillerez en équipe sur des projets innovants intégrant...
Criteo,Software Engineer for Advertiser Platforms, This is truly big data and machine learning without the buzzwords. Our engineers develop industry leading machine learning techniques working on feature...
Quantmetry,BLOG, ACCUEIL NOTRE OFFRE BLOG R&amp;D CARRIÈRE QUI SOMMES-NOUS ? CONTACT ACCUEIL Thèmes Machine Learning Deep Learning Théorie R&amp;D Intelligence Artificielle...
SWORD,Directeur Conseil Blockchain," IA, machine learning, sécurité IT, authentification forte, signature électronique, web sémantique, etc. Le groupe Sword recherche en France son Directeur..."
Criteo,"Data Scientist, Product Analytics & Data Science", This is truly big data and machine learning without the buzzwords. Who we are....
Groupe Onepoint,Consultant.e Supply Chain 4.0," D’autres évolutions sont en cours avec l’intelligence artificielle, le Machine Learning… qui rentrent aujourd’hui dans les fonctions de la supply chain en..."
IQVIA,Sr Data Scientist, Development of machine learning and data mining technologies. Using machine learning techniques to predict disease outcomes and early diagnoses....
Quantcast,Account Manager," Fueled by live data drawn from more than 100 million web and mobile destinations, Quantcast applies machine learning technology to help marketers, publishers,..."
Groupama,Responsable de projets Intelligence Artificielle H/F," Conduite de projets et études sur l'intelligence artificielle (Chatbot, machine learning, deppe learning, NLP, etc, intégration de solutions)...."
ENGIE BU France BtoC - DGP,"Chargé d’études connaissance Clients (Statistiques, Data Scientist) H/F"," Plateforme hadoop, boost gradient machine, R Shiny, machine learning). ENGIE est un acteur mondial de l’énergie, résolument engagé dans la transition..."
Skillink,Ingénieur·e Etudes Traitement Données - Data / Machine Learning," Participer / mener de nombreuses études sur l’identification de contenus, leur catégorisation par Machine Learning, la détection d’Entités Nommées, les formats..."
Dassault Systèmes,STAGE - Data scientist - sémantique / expression embedding & mapping automatique ...," Data Science / Machine learning. Python, pratique du Machine Learning et du deep learning. Vous serez intégré(e) à une équipe pilote de data scientists,..."
Q-Hedge Technologies,Quantitative Investment Manager F/H," Elastic Search, Python (un peu de C++) et Machine learning (scoring et réseaux bayésiens) dans une optique Global Macro...."
FITLE,DÉVELOPPEUR FULLSTACK, Une expérience avec le machine learning est un plus. WHAT YOU WILL DO....
Criteo,Product Manager Identity, This is truly big data and machine learning without the buzzwords. Who we are....
-,Ingénieur(e) de recherche expérimenté(e) en apprentissage machine et intelligence artificielle (H/F)," Design patterns , Systèmes d’informations , Laboratory , ALGORITHMIE , Programming Voir plus Statistics , Innovation , Python , Ecole ingenieur , Sûreté , C / C..."
Criteo,"Software Development Engineer, Engineering - Software Development", This is truly big data and machine learning without the buzzwords.  Work with engineering leadership to develop long-term roadmaps and architectures to scale...
Brand And Celebrities,Rédacteur Web / Social Media Manager (H/F)," Big data, algorithmes de matching, R&amp;D et machine learning sont au cœur du développement de Brand and Celebrities qui ambitionne de devenir le leader mondial en..."
CAPFI,Data Engineer," Conception, développement et optimisation des algorithmes de Machine Learning, Deep Learning. Vous accompagnerez nos clients sur les phases de POC et/ou d..."
Teamnet France,DEVELOPPEUR EN INTELLIGENCE ARTIFICIELLE (H/F)," Connaissance des principaux algorithmes de Machine Learning. C, C++, R, Big Data, Deep Learning, JAVA, XML. Vous êtes un passionné d’informatique ?..."
Premier Ministre,Stage data-scientist, Il ou elle devra avoir des connaissances à la fois en statistiques et machine learning et des connaissances en programmation (R et/ou Python)....
McKinsey & Company,Strategy Consultant - Digital McKinsey," Previous experience in a technology/ IT strategy related role combined with expertise in areas such as digital strategy/ transformation, IT infrastructure &amp;..."
Total,Data Scientist (H/F)," Les data sciences comprennent les modèles de données, la programmation, les statistiques, le machine learning, l'analyse et la visualisation de données..."
23/08/2018,Data Scientist H/F," Vous maîtrisez R et SAS et les principales méthodes de modélisation statistique et machine learning. Le groupe Fnac Darty, recrute, au sein de la Direction..."
Vizeo Technologies,architecte big data / Freelance," Collaborer avec le métier sur des projets de type alimentation de Data Lake, Data Processing et Machine Learning...."
CAPFI,Data Analyst," De formation Bac +5 en Statistiques, vous maîtrisez les langages Python, R et SAS, vous connaissez les méthodes en Machine Learning et savez où aller rechercher..."
Sowee,Datascientist F/H," Implémenter des modèles optimisés de machine learning, statistiques ou IA. Pour accompagner son développement commercial et avec l’ambition de développer de..."
OCSI,DATA ARCHITECT / Freelance, Une web APIs permettant d’appeler des algorithmes de Machine Learning s’exécutant sur une plateforme hadoop (Hortonworks) et de retourner le résultat....
Criteo,"Site Reliability Engineer - Hadoop, Engineering - Site Reliability", This is truly big data and machine learning without the buzzwords. Who we are....
Criteo,"Site Relability Engineer - NoSQL, Engineering - Site Reliability", This is truly big data and machine learning without the buzzwords. Who we are....
Criteo,Software Development Engineer, This is truly big data and machine learning without the buzzwords.  Work with engineering leadership to develop long-term roadmaps and architectures to scale...
Fidel Technologies,Data Scientist-Spanish Speaking," You have advanced technical skills in Applied Mathematics, preferably in machine learning and/or operations research...."
Fidel Technologies,Data Scientist-German Speaking," You have advanced technical skills in Applied Mathematics, preferably in machine learning and/or operations research...."
Scortex,FPGA DEVELOPER INTERN," Working along our hardware team, you will be in charge of developing IPs that will be included into the next generation of machine learning computing..."
ACTIVUS-SERVICES,Data Scientist F/H," Machine Learning, Hadoop, Neo4J, Cypher, R, Python, PySpark, SAS ou MATLAB. Pour renforcer nos...."
McKinsey & Company,Data Scientist - Advanced Analytics," Programming (focus on Machine Learning):. Undergraduate degree in Maths, Statistics, Physics, or Engineering...."
AXA,Chargé d’études statistiques (F/H)," Bonne connaissance des algorithmes de machine learning (GBM, Random Forest, réseau de neurones, k-NN…). Chargé d’études statistiques(F/H)...."
365Talents,Account Manager," Grâce à nos algorithmes de machine learning et d’analyse du langage naturel, notre plateforme révèle en temps réel les compétences des collaborateurs quelles qu..."
Adelean,ARCHITECTE SOLUTIONS MOTEURS DE RECHERCHE / SEARCH," Elasticsearch, Kibana, Logstash, Beats, X-Pack (Graph, Machine Learning, Security) et et leur écosystème Open Source :. WHAT YOU WILL DO...."
Veolia,Contrat de Professionnalisation - DATA Scientist," Parfaite connaissance des algorithmes de machine learning de type Decision Tree, Random Forest, Boosting, Neural Network...."
Criteo,"Sr. Network Engineer, Engineering - Infrastructure", This is truly big data and machine learning without the buzzwords. Who we are....
BeNext,Data Scientist," Machine Learning, Deep Learning, text mining, NLP... BeNext regroupe une #communauté de spécialistes et de talents passionnés par l’innovation, les technologies..."
Amazon EU SARL (FR),"Data Scientist, EU Amazon Vendor Services"," Apply Statistical and Machine Learning methods to specific business problems and data. THIS ROLE COULD BE BASED IN PARIS, MILAN, MADRID, MUNICH, LONDON OR..."
Planet Expat,Marketing Manager," Founded in 2016, we have been growing fast and are now a team of 12 people that includes experts in Machine Learning, Artificial Intelligence, Data Scientists..."
Schibsted Media Group,"Front End Software Engineer, Serenity", It’s deployed in 6 countries and is utilising the latest machine learning techniques to provide a safer experience for over 12 million customers in the last 6...
Altaide,Data & Machine Learning Engineer / Incubateur Groupe de premier plan (H/F)," Vous serez amené à mettre en place des chaînes bout en bout de traitement de la data, de l’ingestion à l’exposition d’apis dans des environnements cloud et..."
Groupama,Data Engineer H/F," Machine Learning, Deep Learning et Intelligence Artificielle afin de pouvoir travailler en collaboration avec les Data Scientists...."
AXA,Data Scientist (F/H)," Good knowledge and practice of machine learning, including libraries (e.g. The Data Scientist’s main mission is to provide deep technical expertise and to..."
Wavestone,Consultant Secteur public - H/F," Shake 'up, The Factory, CréaDesk, Machine Learning &amp; Data Lab, Research &amp; Knowledge Center. Description du poste...."
Adobe,Front End developer, Exposure to Machine Learning algorithms and how to leverage them in UI related aspects. Seize learning and knowledge sharing opportunities. Front End developer....
Ineat Conseil,Ingénieur d'Affaires H/F," Forte sensibilité aux solutions de Commerce Connecté, de Gestion de l’Information, de Gestion des Data, de Machine Learning, … et au secteur des nouvelles..."
In-Team,Développeur iOS – Application mobile disruptive de covoiturage – 55/65K€," Alors prenez part au projet d’une startup dynamique d’une vingtaine de personnes souhaitant révolutionner les trajets du quotidien grâce au BIG DATA, à l..."
Scortex,SOFTWARE ENGINEER: SYSTEM & NETWORK," Tools for machine learning and data management. The system components include hardware with associated software drivers, messaging, machine learning and user..."
Google,Software Engineering/Site Reliability Engineering Intern 2018," Contribute to a wide variety of projects utilizing natural language processing, artificial intelligence, data compression, machine learning and search..."
