company,job,summary
Crédit Agricole S.A.,Linguiste Expert en traitement de langage naturel H/F," Maitrise d'open-sources de traitement du Langage Naturel et de Machine Learning,. Société cotée, Crédit Agricole SA est l'organe central de contrôle du Groupe..."
Google,"Ingénieur(e) logiciel, titulaire d'un diplôme universitaire (2018)"," Développer de nouveaux algorithmes et systèmes destinés aux produits utilisés par le public, à l'aide de techniques telles que l'exploration de données, le..."
Meetic Group,Stage - Analyste Sécurité," Travailler à la mise en place d’un machine learning et/ou dataviz, basé sur les logs réseaux et applicatifs. Nous recherchons un analyste sécurité (H/F)...."
ASPERTISE,Ingénieur en Intelligence artificielle F/H, Connaissance des principaux algorithmes de Machine Learning. Profil recherché Diplôme d'ingénieur requis (et/ou Bac+5) avec dernière année de spécialisation en...
Brand And Celebrities,Assistante RH (Stage)," Big data, algorithmes de matching, R&amp;D et machine learning sont au cœur du développement de Brand and Celebrities qui ambitionne de devenir le leader mondial en..."
Avisia,ALTERNANCE - Consultant Data Scientist," Benchmark des nouveaux outils/méthodes de Machine Learning,. L'objectif de nos missions est de faire participer nos consultants à la réalisation et au..."
Planet Expat,Strategic Partnerships Manager," Founded in 2016, we have been growing fast and are now a team of 12 people that includes experts in Machine Learning, Artificial Intelligence, Data Scientists..."
Deloitte,Manager – Financial Crime Analytics (H/F)," Afin de cerner ces enjeux cruciaux et complexes, nos clients attendent également d’être accompagnés dans le déploiement de technologies de pointe (Machine..."
CREDIT DU NORD,Data Scientist – Paris (75)-(H/F)," Créer des modèles de machine learning et de clustering (algorithme de recommandation, look-alike, analyse comportementale et segmentation de clients) ;..."
Avanade,Data Scientist H/F," Excellent understanding of machine learning techniques and algorithms such as (Logistic Regression, Decision Trees, Random Forrest, Support Vector Machines,..."
Système U,Responsable d'études statistiques H/F," Développer des algorithmes de machine learning ou de traitement de données :. Nous recherchons pour notre site de Rungis (94), UN(E) RESPONSABLE D’ÉTUDES..."
Criteo,"Software Engineer for Infrastructure, Engineering - Software Development", This is truly big data and machine learning without the buzzwords. Who we are....
BVA Group,DATA SCIENTIST H/F," Vous maîtrisez les logiciels de traitement/modélisation statistiques et programmation (SAS, R, Python, …) et avez déjà travaillé avec des outils de Machine..."
FNAC DARTY,Data Scientist F/H," Ingénieur(e) de formation, spécialisé(e) en data science et en machine learning, seront attendus de votre part rigueur, aisance relationnelle, un fort esprit d..."
BNP PARIBAS Cardif,"DATA SCIENTIST, H/F"," Classification, régression, bagging, boosting, stacking, text mining &amp; NLP, deep learning (CNN,RNN,GAN), approches supervisées, semi ou non supervisées, batch..."
IQVIA,"Data Production Analyst, RWAS Technology"," In our quest to harness the value of Real World Evidence (RWE), we are at the centre of IQVIA’s pursuit of machine learning and cutting-edge statistical methods..."
SAP,Internship - M/F," Support Machine Learning Campaign creation. As an ideal candidate (f/m), you already have understanding with latest machine learning technology, and curious to..."
ENGIE Digital,ENGIE Digital - Data Engineer (H/F), Vous rejoindrez le centre d’expertise Data Analytics et Machine Learning dont le rôle est de développer les projets à forte valeur ajoutée autour la Data....
Criteo,Site Relability Engineer - NoSQL, This is truly big data and machine learning without the buzzwords. Who we are....
Wavestone,Consultant People & change H/F," Shake 'up, The Factory, CréaDesk, Machine Learning &amp; Data Lab, Research &amp; Knowledge Center. Type de contrat :...."
Planet Expat,Full Stack Engineer," Founded in 2016, we have been growing fast and are now a team of 12 people that includes experts in Machine Learning, Artificial Intelligence, Data Scientists..."
Sia Partners,Consultant(e) Data Science," Machine learning et statistiques :. Pour accompagner son développement, Sia Partners recrute des consultants data scientist...."
Wavestone,Consultant Industrie H/F," Shake 'up, The Factory, CréaDesk, Machine Learning &amp; Data Lab, Research &amp; Knowledge Center. Description du poste...."
Exakis,Manager en architecture (H/F)," Architecture Big Data, Machine Learning, IA, Chatbot. La practice Architecture est au cœur de l’engagement de Magellan Partners envers ses clients...."
CS Communication & Systèmes,Ingénieur Data Scientist Junior H/F," Data visualisation, data wrangling, statistiques, Machine Learning, …; Ingénieur de formation ou équivalent universitaire (BAC+5), vous bénéficiez de..."
Saint-Gobain,Ingénieur Data Scientist (H/F)," Bonne connaissance des méthodes de Machine Learning ; Nous recherchons pour la société Saint-Gobain Glass France, un ingénieur data scientist afin de réaliser..."
La banque postale,Data Quality Manager H/F CDI," Par ailleurs, la digitalisation des processus bancaires, le développement de l’Open Data et l’usage des nouvelles technologies (Big Data, Machine Learning, IoT…..."
FNAC DARTY,Data Scientist H/F, Vous maîtrisez R et SAS et les principales méthodes de modélisation statistique et machine learning. MARKETING - MARKETING DIGITAL....
Dynacentrix,Product Manager H/F - DATA SCIENTIST," Les domaines d’intervention regroupent l’analytique, le machine learning, les problématiques de recherches opérationnels, et le deep learning...."
1000mercis,Chef de Projets Big Data / RTB," Vous faites preuve d'un intérêt prononcé pour le marketing et la publicité sur Internet, le marketing relationnel et les techniques de Machine Learning..."
Institut Pasteur,Expert en Classification de l'Information H/F," Vous êtes à l'aise avec les concepts techniques associés (machine learning, hadoop, spark, etc.). Informatique - Ingénieur technique confirmé (Informatique)...."
Urban Linker,DEVELOPPEUR FULLSTACK REACT / PYTHON | MACHINE LEARNING | PARIS CENTRE | (H/F)," En utilisant beaucoup d'algorithmie, de machine learning, et de statistiques comportementales, l'entreprise s'est aujourd'hui imposée comme un élément..."
Triskell Consulting,Ingénieur Développement et Support – Monitoring Réseau (F/H), Vous aurez la possibilité de monter en compétence sur les technologies liées au BigData et au Machine Learning....
Criteo,"Product Manager Identity, Product", This is truly big data and machine learning without the buzzwords. Who we are....
ANALYSE INFORMATIQUE DE DONNEES,Data Engineer F/H," Industrialiser des pipelines d’analyse et de machine learning. Distribution Hortonworks, Cloudera ou MapR, outils de data viz, librairies de Machine Learning,..."
Sept Lieues SAS,Data Engineer," Deep learning, speech recognition, rust, scala. Startup basée au centre de Paris, développant un produit autour de l'intelligence artificielle.Vous rejoindrez l..."
AXA,Data Scientist - Stage - (F/H)," Expérience en data mining, statistiques et machine learning. Soit en allouant des ressources pour délivrer rapidement des projets de traitement de la donnée..."
Aviva,Chargé d'études propension à l'achat / Alternance F/H, Vos connaissances techniques en statistiques ou machine learning vous permettront de mener à bien votre mission....
Openfield,Développeur C# (H/F)," Veille sur les nouvelles technologies (Cloud, Bigdata, IOT, Machine learning…). Rattaché au Manager de l’équipe « Data Management Plateform » du Pôle Technique,..."
InnoValeur,DEVELOPPEUR FULL-STACK, Interagir avec nos équipes de Data Scientists et experts en Machine Learning et Intelligence Artificielle pour prendre les meilleures options....
EY,Consultant Smart Robotics secteur financier H/F," Text Mining, Machine Learning,. EY rassemble aujourd’hui 231 000 associés et collaborateurs à travers le monde dans plus de 150 pays...."
ADOMIK,Publisher Solution Manager F/H," Chez Adomik, nous sommes passionnés par nos clients et nous recherchons donc un Sales Manager de tout premier plan, prêt à rejoindre notre équipe en..."
Exakis,Manager en organisation – Data Science (H/F)," Data Science (Analytique, Machine Learning, Big-Data…), APIs, Blockchain, Open-Data et Data-Driven Company...."
Criteo,"Internship - Product Specialist Data Analyst, Product", This is truly big data and machine learning without the buzzwords. Who we are....
TEAMNET,Développeur.euse en Intelligence Artificielle F/H," Connaissance des principaux algorithmes de Machine Learning. C, C++, R, Big Data, Deep Learning, JAVA, XML...."
Viveris,passionné(e)s de Data ! Pour 10 postes de Data scientists H/F," Choisir et mettre en place des algorithmes de machine learning. Machine Learning, Big Data, Business Intelligence, intelligence artificielle, IoT, objets..."
Criteo,Site Reliability Engineer - Hadoop, This is truly big data and machine learning without the buzzwords. Who we are....
Investment Technology Group (ITG),React Developer," Opportunities to work with a wide spectrum of technologies, such as functional languages, low latency programming, machine learning, and cloud computing...."
AXA,Data Solutions Analyst," Connaissance avancée théorique et pratique des algos de machine learning. Dans le cadre du plan de transformation de l’équipe Data Management , le domaine de..."
Merck KGaA,Ingénieur Junior Data Science (H/F)," Logiciels de statistiques, data science et machine learning. Vous exploitez ces données avec des algorithmes de Machine Learning afin d’aider à la décision et..."
Criteo,"Data Scientist, Product Analytics & Data Science, Product", This is truly big data and machine learning without the buzzwords. Who we are....
STMicroelectronics,AI Appli Dev Sr Staff Eng, We are looking for an experienced Application Engineer specialized in Artificial Intelligence / Machine Learning for our site of Paris....
BEEZEN,DATA SCIENTIST, Tester les hypothèses de manière itérative et converger vers une solution Tirer profit des algorithmes Machine Learning pour vous aider dans vos investigations...
Dassault Systèmes,STAGE - Ingénieur Recherche - Deep Learning for 3D Modeling (H/F), Bonnes connaissances en Mathématiques et Apprentissage statistique (Machine/Deep Learning). Ce stage consistera à répondre à cette problématique en explorant...
KPLER,Front-end Developer Internship, Designing our API interfacesAbout our team and architecture Our team is made of 25 engineers in fond of data who are experts in machine learning and data...
Dunforce,Développeur full stack (symfony)," Des notions de machine learning et big data serait également appréciées. Nous recherchons un développeur back end, avec une expérience confirmé en Symfony...."
Thales Group,Stagiaire en Intelligence Artificielle (H/F)," Vous avez des connaissance en techniques d’intelligence artificielle (neural network, machine learning, deep learning)?..."
Criteo,"Full-Stack Developer, Engineering - Software Development"," This is truly big data and machine learning without the buzzwords. We're an industry leader in machine learning and deep learning, working on feature extraction..."
JOHN PAUL,Data Manager H/F," Proposer des options et une réponse la plus adaptée au besoin (reporting, machine learning, segmentation, scoring, analyse textuelle…)...."
Meritis Finance,Data Scientist (H/F)," Analyser les besoins métier (use case) et proposer des supports de présentations (analyse explo, prediction, machine learning)...."
Openfield,Data Engineer (H/F)," Implémentation de modèles de machine learning, respectant nos contraintes de volumétrie et de latence. De formation supérieure en informatique, le développeur..."
Generali France,Data scientist IARD H/F," De formation supérieure spécialisée en Data science / Big Data, vous justifiez idéalement d'une expérience au sein d'une équipe actuarielle vous ayant permis d..."
Criteo,Full-Stack Developer," This is truly big data and machine learning without the buzzwords. We're an industry leader in machine learning and deep learning, working on feature extraction..."
IPSEN,Artificial Intelligence Project Leader H/F, Job Description: The best and the brightest can always choose their mission. Are you ready to act for patient care through a data-driven approach? We want...
TINYCLUES,Full-stack & Dataviz Software Engineer," You will play with some of the sexiest piece of technologies available (react, d3, play/scala, machine learning...), and help going even one step further...."
Criteo,"Sr. Software Engineer (Python), Engineering - Software Development", This is truly big data and machine learning without the buzzwords. Who we are....
Criteo,Product Manager - Engine for New Products, This is truly big data and machine learning without the buzzwords. The Engine is the set of machine learning algorithms and underlying data that enable us to...
Veolia,Data Scientist H/F," -Parfaite connaissance des algorithmes de machine learning de type Decision Tree, Random Forrest,. Objectifs du Poste...."
Wavestone,Analyst / Consultant IT H/F, Proposer des solutions digitales innovantes en s'appropriant rapidement de nouveaux thèmes et construire des maquettes et des modèles intelligents pour tester...
Edge-Factory,Développeur Front-End ReactJS,"  Culture générale de l’entreprise, appétence pour le web, le machine learning, et même, pourquoi pas, le conseil en stratégie...."
Showroomprive.com,DATA SCIENTIST - H/F," Modélisation, prototypage et validation des algorithmes de Machine Learning / Deep Learning. Solides connaissances des algorithmes de Machine Learning...."
Sidetrade,HR/Recruiting Intern, Market Leader in AI &amp; Machine Learning. 6 months internship....
Criteo,Software Engineer for Infrastructure, This is truly big data and machine learning without the buzzwords. Who we are....
C3 IoT,Alliance Director - Microsoft Azure," Cloud computing, big data, and AI/machine learning concepts. C3 IoT meets an urgent and fast-growing demand for enterprise scale Big Data, AI, and IoT..."
Exakis,Consultant en organisation – Data Science (H/F)," Data Science (Analytique, Machine Learning, Big-Data…), APIs, Blockchain, Open-Data et Data-Driven Company...."
Wake It Up,Intégrateur front ++ javascript & analytics," Basé principalement sur les problématiques de Data, IA et Machine Learning, le logiciel est utilisé par des sociétés Web E-commerce telles que :...."
Dentsu Aegis,DATA Scientist (H/F), Machine learning &amp; Big Data :. Vous maîtrisez les techniques statistiques de machine learning et vous maîtrisez les approches dataminning liées au big data....
Expertime,Architecte Solution (H/F) - mission (91)," Expertime spécialiste du Cloud Microsoft accompagne ses clients sur des projets Open Digital, Azure, Office 365, Data et Machine Learning...."
Matcha,STAGE SOFTWARE ENGINEER : VENEZ ENCHANTER L’EXPÉRIENCE VIN AVEC NOUS !," WHAT YOU WILL DO Votre mission Votre mission sera d’améliorer nos technologies de sommelier, en particulier sur notre stack back-end. En Python / Mongodb,..."
Deloitte,Consultant junior Gestion des Risques de Crédit (H/F), Intégration de nouvelles générations d’outils d’analyse de données de type BI ou Machine Learning pour optimiser les modalités de réalisation des travaux de...
Criteo,"Product Manager, Advertising Platform", This is truly big data and machine learning without the buzzwords. Who we are....
Micropole,EXPERTS DATAMINING / DATASCIENCE H/F," Pour vous, la data science ne se résume pas à appliquer des algorithmes de machine learning à l’aveuglette et des milliers de modèles sur une table toute..."
yele,"Consultant Data Scientist, secteur énergie H/F"," Vous maitrisez les principaux logiciels statistiques, les langages SQL et programmation R, les méthodes de machine learning...."
BearingPoint,HyperCube - Data Scientist (H/F)," Les technologies de machine learning. Supervisé, non-supervisé, textmining, social web mining, etc… Vos connaissances dans les méthodologies deep learning et..."
Criteo,Sr. Software Engineer (Python), This is truly big data and machine learning without the buzzwords. Who we are....
Criteo,"Product Manager - Engine for New Products, Product", This is truly big data and machine learning without the buzzwords. The Engine is the set of machine learning algorithms and underlying data that enable us to...
Ercom,STAGE – Expérimentation d’une plateforme de sécurisation des flux en mode SaaS," Connaissance des algorithmes de Machine Learning. Internet des objets (IoT), Intelligence Artificielle (IA) et Machine Learning (ML), Analyse et sécurisation de..."
AXA,Chargé d’études actuarielles F/H," Précision de l’outil de géocodage), de proposer en concertation avec son tuteur des axes d'amélioration et de les mettre en œuvre en utilisant des jeux de..."
Google,"Quantitative Analyst/Statistician, Data Science", Experience with Machine Learning on large datasets. Participate in research in statistical methodology and Machine Learning applications....
Business & Décision,Consultant(e) Datascience H/F," Niveau Bac+5 en Informatique Décisionnelle, Statistiques, machine learning, Data Science, Data Mining, Master 2 en Statistiques, machine learning, Data Science..."
managementsolutions,DATA SCIENCE CONSULTANT PARIS, Machine learning and statistical modelling skills:. Predictive modelling with machine learning technics and data science....
Keyrus,Data Engineer H/F (Paris), Vous avez déjà programmé en Scala ou travaillé sur des algorithmes de Machine learning. Vous êtes adeptes du Big Data et souhaitez participer à la croissance d...
Bel Group,Data Scientist (H/F), Préparerez et analysez les données via des méthodes statistiques / machine learning afin de répondre à des problématiques industrielles et de recherche....
Manomano,Head of Design and UX," Les architectures Lambda te parlent, tu vois dans le Machine Learning une formidable opportunité d’innovation, bref tu as soif de data !..."
soft.computing,Manager Data Science," Vous êtes source de conseils tout en participant à la réalisation effective des travaux (machine learning, deep learning, random forest, segmentations, veille..."
Criteo,"Product Manager, Criteo Audience Activation Platform", This is truly big data and machine learning without the buzzwords. Who we are....
BNP Paribas,AFTERWORK RECRUTEMENT «#DATA #DEV #CYBERSÉCURITÉ» LE JEUDI 27 SEPTEMBRE 2018," 2 ans minimum en Data Science, Big Data, Machine Learning. Bac +5 en informatique en école d’ingénieur, école de commerce ou équivalent universitaire avec une..."
365Talents,Stagiaire Business Developer B2B," Grâce à nos algorithmes de machine learning et d’analyse du langage naturel, notre plateforme révèle en temps réel les compétences des collaborateurs quelles qu..."
ooblada,Ingénieur Systèmes & Data," Machine Learning, IA. Développeur indépendant depuis 2009, ooblada fait partie du TOP 20 des sociétés françaises du secteur...."
Dassault Systèmes,STAGE - EXALEAD - Information Intelligence Strategy Analyst (H/F)," Machine learning, internet of things, big data…. Big data, analytics, internet of things, machine learning, analytics, etc...."
Criteo,Internship - Product Specialist Data Analyst, This is truly big data and machine learning without the buzzwords. Who we are....
Microsoft,CSA Finance Manager, You drive digital transformation in the finance function towards data driven (Machine Learning) forward-looking insights. Description of Purpose....
EY,Consultants Décisionnels expérimentés H/F," H/F, de formation supérieure, vous êtes sensibilisé aux sujets analytiques (Business Intelligence, Datavisualisation, Data mining, Machine Learning, etc.)...."
Uniware,Développeur Back-End / Freelance," Kotlin, nlp, machine learning. Nous recherchons un développeur back technophile et passionné affin de réaliser des bots et des assistants virtuels via des..."
Criteo,Software Development Lead, This is truly big data and machine learning without the buzzwords. Our engineers develop industry leading machine learning techniques working on feature...
Expertime,UX/UI Designer (H/F) - CDI à Paris," Expertime spécialiste du Cloud Microsoft accompagne ses clients sur des projets Open Digital, Azure, Office 365 et Machine Learning...."
KPMG,Senior Data Science," Avec 50 consultants en France et un réseau mondial de 4500 personnes, notre équipe Data Analytics accompagne des grands comptes internationaux dans leurs..."
NOKIA,AVA Data Scientists," Master’s Degree in Statistics, Machine Learning, Data Science, Computer Science, Computer Engineering. Propose, test and select the best machine learning..."
Wavestone,Manager en sécurité des systèmes d'information H/F," Exemple de mission - SOCIETE GENERALE - Machine learning. Accompagner et guider le management et l'équipe technique (datascientists, développeurs, experts..."
Entreprises et Collectivités Groupe ENGIE SA,stage stratégie d'optimisation de calage des marges," Machine learning, méthodes de classification et de prédiction. Entreprises et Collectivités - Saint Ouen...."
Kpler,Data Engineer Internship," Our team is made of 19 engineers in fond of data who are experts in machine learning and data science. By joining our agile and fast-growing team, you will..."
Criteo,Product Manager App Advertising, This is truly big data and machine learning without the buzzwords. Who we are....
InnoValeur,ARCHITECTE BIG DATA, Interagir avec nos équipes de Data Scientists et experts en Machine Learning et Intelligence Artificielle pour prendre les meilleures options....
HYPERLEX,Head of Sales (H/F), Une ergonomie radicalement innovante et une technologie avancée d’analyse de données basée sur du machine learning / deep learning....
craft ai,BUSINESS DEVELOPMENT MANAGER - SAAS / B2B," Alignement avec la vision produit (SaaS, Automated Machine Learning, Explainable AI) de craft ai,. WHAT YOU WILL DO...."
Wavestone,Consultant Technologies digitales & émergentes H/F," Shake 'up, The Factory, CréaDesk, Machine Learning &amp; Data Lab, Research &amp; Knowledge Center. Business Transformation (#open architecture), Industrial IoT (..."
KPMG,Stagiaire FRM Credit & Market Risk / Data-scientist," Au sein de notre équipe « quantitative data science », vous serez amené(e) à effectuer des travaux exploratoires de recherche portant sur l’application de..."
VIVERIS TECHNOLOGIES,Ingénieur Data Scientist F/H," Elle conseille sur la mise en place de solutions de Machine Learning et Intelligence Artificielle. Reconnue depuis 25 ans, la division Systèmes Connectés du..."
Wavestone,Consultant Banque et assurance H/F," Shake 'up, The Factory, CréaDesk, Machine Learning &amp; Data Lab, Research &amp; Knowledge Center. Type de contrat :...."
OCTO Technology,Consultant Data Geek (H/F)," Ensemble, boosting, réseaux de neurones et êtes débutant ou confirmé(e) sur les nouvelles avancées en machine learning (notamment en deep learning)...."
Doctrine,Senior Data Scientist," A good knowledge of machine learning. Design and build customized, large-scale cloud-based machine learning systems...."
1000mercis,Assistant(e) Chef de Projets Big Data / RTB," Vous faites preuve d'un intérêt prononcé pour le marketing et la publicité sur Internet, le marketing relationnel et les techniques de Machine Learning..."
EY,Consultant Intelligence artificielle - Secteur financier H/F," Vous avez idéalement une connaissance de l’utilisation d’outils open source d’Intelligence Artificielle, préparation des données, machine learning, deep..."
soft.computing,Consultant Data Science," Déployez les méthodes de Machine Learning adaptées pour répondre aux problématiques posées,. Vous intégrerez le centre de compétence Data Science, constitué de..."
IFSTTAR,Ingénieur en informatique scientifique et logiciel," Connaissance du calcul scientifique et des problématiques de modélisation et simulation numérique (une expérience dans le champ de l’informatique scientifique,..."
Gameloft,Data Science Director," Applies artificial intelligence and machine learning techniques to solve complex questions about Game Analysis (Churn prediction, LTV, etc)...."
BNP Paribas,"ALTERNANT INDEPENDENT REVIEWER - MODEL EXPERT,H/F"," Vous maitrisez également les logiciels R, Python et machine learning, vous avez connaissances des librairies statistiques et du « Data Scientist »...."
Algolia,Senior Software Engineer - Core API," HUMILITY- Aptitude for learning from others, putting ego aside. Ongoing professional education opportunities through internal &amp; external workshops, including..."
MFG Labs,Data Consultant," Strong interest and understanding of statistics and machine learning algorithms. Your mission as a consultant is to design, implement and successfully deploy..."
Econocom,Architecte MSBI H/F," HD Insight, Azure Data Lake Analytics, Azure SQL DataWarehouse, Azure Data Factory, Azure Machine Learning et la BI temps réel avec Azure Stream Analytics...."
Linagora,Data Scientist H/F," En intégrant notre équipe, vous serez en charge du développement des méthodes de Machine Learning et de Deep Learning pour les données récoltées...."
