company,job,summary
"Pandora Media, Inc.","Senior Scientist, Advertising", Experience with large scale applications in machine learning &amp; statistical techniques using Python. Use machine learning and information retrieval techniques to...
KPMG,"Machine Learning Engineer, Manager"," Innovate. Collaborate. Shine. Lighthouse — KPMG's Center of Excellence for Advanced Analytics — has both applied data science, AI, and big data architecture..."
KPMG,"Associate, ML Pipelines for AI Consultant"," Broad, versatile knowledge of analytics and data science landscape, combined with strong business consulting acumen, enabling the identification, design and..."
The Home Depot,DATA SCIENTIST - SPACE OPTIMIZATION," Data mining, optimization, statistics, machine learning, programming, data modeling, database design, retail domain knowledge, and reporting...."
Emory University,Post Doctoral Fellow - Biomedical Informatics," The Emory University Department of Biomedical Informatics is recruiting for a post doctorate in the area of computer vision, image processing, machine learning,..."
Fractal Industries,Regional Sales Manager," We currently work with new and exciting technologies in cybersecurity, machine learning, artificial intelligence and DevOps where we are building intelligent..."
Delta Air Lines,Java Developer," Experience or familiarity with Artificial Intelligence (AI), Machine Learning (ML), or Chatbot technologies or best practices a plus...."
Emory University,Informatics Analyst III (LITS), Experience with advanced processing techniques such as natural language processing and machine learning are desirable but not required....
Emory University,Post Doctoral Fellow," Responsibilities include joining the research team of the Emory Healthy Aging Study (EHAS), a $25 million project, and conducting research in one or more of the..."
Bridgevine Inc.,Digital Merchandising Manager," Join our dynamic Technology Team and make an impact at Bridgevine Inc., the leading provider of customer acquisition solutions for iconic home service brands..."
Fleetcor,Director / Senior Data Scientist," Fluent in statistics, analytics programming (SQL, R, Python), machine learning. The Director / Senior Data Scientist will work closely with eCommerce team to..."
Splice,Solutions Architect, He started Splice Machine to disrupt the $30 billion traditional database market with the first open-source dual engine database and predictive platform to...
Edgewater Technology,"Director of Sales, NA: Microsoft Dynamics"," You will also position other Microsoft technologies such as Modern Workplace, Artificial &amp; Business Intelligence and Machine Learning &amp; IoT and their..."
General Electric,Sr Staff Cyber Intelligence Analyst," Experience with object-oriented programming [Python, Java] Knowledge of machine learning and its applications in information security...."
Moogsoft,Enterprise Account Executive (Atlanta), Moogsoft is the creator of Moogsoft AIOps - a next generation approach to IT Operations and Analytics driven by real-time machine learning....
Honeywell,Cyber Security Director," Experience implementing artificial intelligence, machine learning and cognitive systems. Innovate to solve the world's most important challenges...."
Smith Hanley Associates,"Associate Director, Forecasting- PHARMA"," Experience in statistical techniques i.e. linear regression, logistic regression, decision tree, machine learning methods and time series forecasting techniques..."
Square,Senior Software Engineer," Job Description The Atlanta office houses a number of platform teams at Square. As Square's business continues to experience rapid growth, these teams serve..."
Capgemini,Data Scientist - CONSULTANT Level - ORLANDO FLORIDA - We will help Relocate, Expertise in machine learning algorithms and experience using the following ML techniques:. Design and build scalable machine learning models to meet the needs...
Exabeam,Technical Account Manager," The Exabeam Security Intelligence Platform uniquely combines a data lake for unlimited data collection at a predictable price, machine learning for advanced..."
SunTrust,Sr. Data Science Analyst," Creative thinking and hunger for learning. Analysts on the team work on innovative projects in partnership with several lines of business across the bank,..."
"Tropical Smoothie Café, LLC",Director of Retail Technology," Keep abreast of current trends in the restaurant technology industry, including the growing area of mobile applications, social media integrations, AI, Machine..."
KPMG,"Associate, Emerging Technologies, KPMG Tax Ignition"," One or more digital technologies (Process Robotics, Machine Learning, Data. Machine Learning (SciPy, numpy, etc ), Big Data tools (Spark, Hive, Pig, etc)...."
KPMG,"Machine Learning Engineer, Senior Associate"," Innovate. Collaborate. Shine. Lighthouse — KPMG's Center of Excellence for Advanced Analytics — has both applied data science, AI, and big data architecture..."
Intradiem,Product Manager - Business Intelligence," Intradiem is a leading-edge SaaS company that combines big data, machine learning, real-time automation, integration technologies and robotics to create..."
HatchWorks Technologies,Senior Account Director," Intellectual curiosity and passion around software and emerging technology, such as blockchain, virtual reality, machine learning, and robotics...."
Honeywell,Principal Data Scientist," Machine Learning experience of physical systems. 25 Develop data modeling, mining, pattern analysis, data visualization and machine learning solutions...."
IBM,Senior Android Application Developer, Experience implementing/using models with Machine Learning (ML). A successful candidate for this position will be an active participant in the development of...
Opendoor,Principal Engineer – ATL," Depth and breadth across multiple areas ranging from service oriented architectures, distributed systems, machine learning, algorithms, databases and front-end..."
Applied Resource Group,Senior Business Intelligence Architect, Knowledge of Machine Learning and Predictive Analytics. Senior Business Intelligence Architect....
Georgia Tech Research Institute,Robotics Researcher Software Engineer - ATAS, Machine learning for robotic control. Direct research projects in robotics and unmanned autonomous vehicles and systems....
Harness.io,Senior Sales Engineer," Harness uses a unique machine learning and AI-based approach to continuously verify the performance, quality and security of highly complex software systems,..."
"Pandora Media, Inc.","Senior Scientist, Content Science", Demonstrated expertise in a computational field with a strong background in machine learning and/or statistics....
Bridgevine Inc.,Business Rule (Policy Engine) Developer," Join our dynamic Technology Team and make an impact at Bridgevine Inc., the leading provider of customer acquisition solutions for iconic home service brands..."
Honeywell,"Sr Director, Data Management"," Experience in thought leadership in emerging master data management technologies including machine learning, AI and data science to improve data quality and..."
Candid Partners,DevOps Engineer, AI or Machine Learning playground work or GoLang Experience. Candid Partners- DevOps Engineer....
Voya Financial,"Senior Analyst, Agency Mortgage-Backed Securities"," Programming and coding experience with MATLAB, emphasis on statistics and machine learning. As part of the application process, a candidate account is required..."
Bank of America,Quantitative Finance Analyst/C++ Developer," Experience in competing risk models, financial theory, economics, derivatives pricing, stochastic calculus or machine learning...."
Georgia Tech Research Institute,Algorithm Developer - SEAL, O Machine Learning. The Georgia Tech Research Institute (GTRI) is looking for an Algorithm Developer who can think outside of the box and doesn’t want to do the...
KPMG,"Manager, Blockchain Solutions", Bachelor's degree in a technical field from an accredited college or university (master's or MBA degree preferred) with expertise in programming languages and a...
Newell Brands,Sr. Demand Planning Analyst - Supply Chain," Working knowledge data science techniques (data cleaning, machine learning) and tools (R, Python or a similar modeling language and in SQL) a plus...."
"ACTS, Inc.",Project Manager/Solution Delivery Manager," Our approach is to provide clients with technology-enabled solutions that deliver sustainable business value in areas such as application development,..."
The Home Depot,"Senior Analyst, Marketing Analytics"," Skilled in the use of tools such as SAS, R, and Python for analysis, predictive modeling, or machine learning...."
Micro Focus,"Senior Sales Representative, Vertica Big Data Products"," You will have a background in complex sales, especially in the big data, business intelligence and machine learning software space...."
ThoughtWorks,Lead Data Engineer, Understanding of how to architect solutions for data science and analytics such as productionizing machine learning models and collaborating with data...
"VersionOne, Inc.",Product Marketing Manager," Experience with business intelligence (BI), machine learning, application performance monitoring or predictive analytics. VersionOne is now part of CollabNet!..."
KPMG,"Manager, Development Lead", Bachelor's degree in a technical or quantitative field from an accredited college or university (master's or MBA degree is preferred) with working knowledge of...
Equifax,Web Analytics Lead," Experience with qualitative research and testing, performance management, app rating, sentiment analysis and machine learning methods is a plus...."
Catalina Marketing,Senior Data Scientist," In machine learning, computer science, engineering, mathematics, statistics, operations research, or related discipline AND 2+ years’ experience after graduate..."
"Career Guidant, Inc",Machine Learning Engineer," Knowledge of machine learning algorithms and workflows. Experience with TensorFlow, or similar machine learning frameworks...."
TSYS,"Full Stack Engineer, Digital Innovation Team"," Experience designing and developing large distributed, mobile, machine learning, responsive web or API software systems...."
Inspire Brands,Continuous Improvement and Automation Manager, Fundamental understanding of machine learning and automation. The Continuous Improvement and Automation Manager is a key individual on the Service Desk team....
CIYIS,IoT Solution Architect," Understanding, advocating and augmenting the principles of emerging, innovative IT strategies in disruptive technologies such as IoT, big data, machine learning..."
TSYS,ETL Software Engineer II or Above," Machine Learning – Python, R, Matlab, Tensorflow, DMTK. ETL Software Engineer for our Data Management team will be responsible for delivering high quality data..."
The Coca-Cola Company,IT Solution Architect III - Consumer Marketing Mobile Solution Strategist," Welcomes failure as a learning opportunity. This position will unlock value by capitalizing on CCNA consumer marketing mobile capabilities, including services,..."
ThoughtWorks,Senior Software Developer, Helping our clients become data-driven businesses by making real-time data available and using machine learning for competitive advantage....
TSYS,"Technical Business Analyst, Product Innovation Team"," Experience designing and delivering large distributed, mobile, machine learning, responsive web or API software systems...."
MHP – A Porsche Company,(Senior) Consultant for Data Science," Ideally knowledge of Machine Learning. Get involved in challenging projects in management-, process- and IT-consulting with focus on Big Data and Business..."
IntroPro,Systems Engineer / Architect, (Optional) Machine Learning and Chatbots. Experience working with machine learning or chatbots. Think with customers....
The Home Depot,SENIOR DATA ANALYST SUPPLY CHAIN," Writing SQL/code, statistics, machine learning, etc.). A Sr Data Analyst Supply Chain leverages proven technical abilities to synthesize complex analytical..."
The Home Depot,Senior Business Intelligence Analyst," Writing SQL/code, statistics, machine learning, etc.). A Sr Business Intelligence Analyst Supply Chain leverages proven technical abilities to synthesize..."
PNC Financial Services Group,Business Analytics Consultant Sr," Practical experience with data science techniques and machine learning algorithms. Your activities will include designing, prototyping, testing and implementing..."
Google,"Strategic Cloud Engineer (East), Google Professional Services"," Hands-on experience in big data, information retrieval, data mining or machine learning as well as experiences in building multi-tier high availability..."
Wyzant,Computer Science Tutor/Teacher," A love of learning. I am currently on a data science course, and need help with machine learning for my capstone project. Marietta, GA 30062...."
Cotiviti,Senior Data Scientist," Machine learning, applied scientist, data science, data analyst. Experience in machine learning, artificial intelligence and/or artificial neural networks...."
InterContinental Hotels Group,Principal Integration Architect," Big Data Data Design Principles and Best Practices Reporting and Analytics Design Patterns Data Platforms knowledge for Data Residency decisions (Teradata,..."
Micro Focus,DevOPs Security Engineer," DevOps | IT Operations| Cloud | Security | Info Governance | Big Data, Machine Learning, &amp; Analytics. At Micro Focus, everything we do is based on a simple idea..."
SGA,Data Scientist," Machine Learning Models (deep understanding):. Software Guidance &amp; Assistance, Inc., (SGA), is searching for a Data Scientist for a full time assignment with..."
KPMG,"Senior Associate, Blockchain Developer", Bachelor's degree in a technical field from an accredited college or university (master's or MBA degree preferred) with expertise in programming languages and a...
TSYS,"Engineering Manager, Digital Innovation Team", We leverage technology in completely new ways to construct fully automated financial platforms that live in the cloud and take advantage of the latest machine...
Equifax,Pre-Sales Analytics - Lead Data Scientist, Experience building logistic and linear regression solutions as well as knowledge of machine learning and other alternative methodologies preferred....
IHG Corporate,Principal Integration Architect," Big Data Data Design Principles and Best Practices Reporting and Analytics Design Patterns Data Platforms knowledge for Data Residency decisions (Teradata,..."
Equifax,"Director, Global Security Risk Reporting"," Experience with Big data, statistical modeling, datamining and machine learning (R, Python, SAS, etc.). The Director, Global Security Risk Reporting is a..."
Diverse Lynx,Data Scientist with Energy Industry Experience," Python, R,SQL, NLP, Excel, Machine learning, Statistical Modelling, Java. Data Scientist with Energy Industry Experience...."
Exabeam,Senior Software Engineer," Opportunity to work with the latest technologies in distributed systems, machine learning and high-volume data processing...."
Micro Focus,Software Sales Account Executive - IT Operations Mgt Software - Southeast US," DevOps | IT Operations| Cloud | Security | Info Governance | Big Data, Machine Learning, &amp; Analytics. Sales Account Executive, IT Operations Management...."
Georgia Tech Research Institute,Software Engineer - CIPHER," These systems will work with very large data sets, integrate expert systems and machine learning techniques and participate in internal R&amp;D (IRAD) associated..."
KPMG,"Sr. Associate, ML Pipelines for AI Consultant"," Modeling (regression, machine learning, feature selection, dimension reduction, validation); Strong knowledge in design and building of machine learning..."
Axius Technologies,DATA SCIENTIST, Develop statistical approach for generating insights from structured and unstructured customer product data - Develop and deploy machine learning /statistical...
Equifax,Security Architect," Use machine learning or advanced techniques to identify security risks. Global Security, Build Team...."
Honeywell,Principal Video Architect," Familiarity with various video analytics and machine learning/ AI platforms, e.g. GPUs, embedded, and cloud based services...."
Emory University,"Assistant Professor -RT - Streaming Clinical Informatics, Data Science"," Bioinformatics software development, data warehousing and data mining, massive scale database searches, cloud computing, machine learning, signal &amp; image..."
Verizon,Principal Data Scientist, Deep technical expertise in machine learning and statistical modeling. 8+ years of experience in practicing machine learning and data science in business....
SunTrust,"Managing Director, Data Scientist"," Execution of this role will require an understanding of data modeling, statistical modeling, machine learning, data lineage and governance, as well as an..."
Feedzai,Senior Software Engineer," The world's largest banks, payment providers and retailers use Feedzai's machine learning technology to manage risks associated with banking and shopping,..."
Capgemini,"Data Scientist - Consultant Level - Orlando, Florida - we will assist with relocation", Expertise in machine learning algorithms and experience using the following ML techniques:. Design and build scalable machine learning models to meet the needs...
Amtex Enterprises,Data Scientist," Data Analytics, Machine Learning nano degree. Proven track record of delivering projects utilizing Machine Learning and/or Statistical Learning...."
Capgemini,Manager - Data Scientist ! Orlando!, Expertise in machine learning algorithms and experience using the following ML techniques:. Design and build scalable machine learning models to meet the needs...
"Anthem, Inc.",Data Scientist or Data Scientist Lead PS10268," Requires MA/MS in Statistics, Computer Science, Mathematics, Machine Learning, Econometrics, Physics, Biostatistics or related Quantitative disciplines...."
Accenture,FY19Q1 SE Innovation Hub Consultant, Minimum 1 year of knowledge of machine learning. Work closely with Georgia Institute of Technology faculty and researchers in such domains as Artificial...
Delta Global Staffing,Engineering Data Scientist, Experience in applying machine learning techniques and metrics with focus on Natural Language Processing in real world applications....
Georgia Tech Research Institute,Senior FPGA Hardware Researcher - CIPHER," High-speed networking, wireless communications, radar applications, image processing, machine learning. Georgia Tech Research Institutes's (GTRI) Trusted..."
KPMG,Director - ML Pipelines for AI Consultant, Minimum of two years of training specific to machine learning and/or artificial intelligence. Strong knowledge in design and building of machine learning...
KPMG,Manager Big Data Architect," Bachelor's degree in a technical or quantitative field from an accredited college/university with working knowledge of topics such as computer science,..."
Microsoft,Cloud Solution Architect - Advanced Analytics & AI," We are always learning. Business Intelligence, Big Data, Data Governance, Data Science, Machine Learning, Artificial Intelligence...."
AnswerRocket,Senior Software Developer/Engineer," Our software uses natural language data discovery and machine learning algorithms to enable business leaders to make better, faster decisions...."
Georgia Tech Research Institute,Senior Algorithm Developer - SEAL, O Machine Learning. The Georgia Tech Research Institute (GTRI) is looking for an Algorithm Developer who can think outside of the box and doesn’t want to do the...
KPMG,"Senior Associate, Data Scientist (NLP/AI)"," Machine learning, data visualization, statistical modeling, data mining, or information retrieval. Machine learning (ML), natural language (NLP), artificial..."
TSYS,"Java Product Engineer, Digital Innovation Team (or Above)"," Experience designing and developing large distributed, mobile, machine learning, responsive web or API software systems...."
KPMG,Senior Associate - Cognitive Data Scientist Natural Language Processing," Experience in Artificial Intelligence, Machine Learning, Natural Language Processing, Cognitive Science or other related areas...."
Equifax,Network Security Architect, Use machine learning or advanced techniques to identify security risks. Network Security Architect....
KPMG,"Manager, Data Scientist"," Machine learning, data visualization, statistical modeling, data mining, or information retrieval. Perform machine learning, natural language, and statistical..."
Micro Focus,"Sr. Software Engineer, Security - Fortify"," DevOps | IT Operations| Cloud | Security | Info Governance | Big Data, Machine Learning, &amp; Analytics. At Micro Focus, everything we do is based on a simple idea..."
Verizon,Principal Big Data Engineer," Keep abreast of data science and machine learning tools and methodology and technology, industry trends and competitive landscape to identify new tools,..."
Newell Brands,"Sr. Manager , Data Science Forecasting", Develop and implement forecast algorithms leveraging time series and machine learning methods to improve forecast accuracy for Demand Planning and Financial...
KPMG,Manager - Cognitive Data Scientist Natural Language Processing," Experience in Artificial Intelligence, Machine Learning, Natural Language Processing, Cognitive Science or other related areas...."
Amazon.com,"Principal Solutions Architect, Database & Analytics"," Experience with Statistics, Machine Learning and Predictive Modelling. Amazon Web Services (AWS) is seeking a Solutions Architect to work with our customers and..."
KPMG,"Sr Associate, Data Science, KPMG Tax Ignition"," Define and develop new Tax solutions leveraging approaches such as Natural Language Processing (NLP), Linguistics, Advanced Semantic Design, Visualization,..."
Georgia Tech Research Institute,Branch Head for FPGA Hardware Research and Development - CIPHER," High-speed networking, wireless communications, radar applications, image processing, machine learning. Georgia Tech Research Institutes's (GTRI) Trusted..."
AXIS Insurance,"Senior Application Delivery Lead - Risk, Pricing & Modelling"," Experience developing projects related to multi-tier, web, console applications, Windows Services, and Windows Forms using software technologies like Microsoft..."
KPMG,"Director, Data Scientist"," Statistics, data mining, machine learning, statistics, operations research, econometrics, natural language processing, and/or information retrieval...."
GEORGIA-PACIFIC,"Sr. Analyst/Manager, Consumer Promotion and Media Analytics, GP Consumer Business"," Experience with cognitive computing, artificial intelligence, machine learning, data mining and/or predictive analytics. Who is Georgia-Pacific?..."
GEORGIA-PACIFIC,Manager - Decision Analytics, Experience with machine learning techniques – supervised and unsupervised. Who is Georgia-Pacific?Watch to find out!...
Micro Focus,Sr. Security Software Engineer - Fortify Webinspect," DevOps | IT Operations| Cloud | Security | Info Governance | Big Data, Machine Learning, &amp; Analytics. If you have a drive for learning and an interest in..."
Accenture,Data Scientist Manager (Resources)," Successfully develop, conceptualize and test various statistical and machine learning models. Experience leading or collaborating with a team of data scientists..."
Accenture,Artificial Intelligence Consultant," Basic understanding of Machine Learning techniques &amp; industry applications. Learning takes place both on the job and through formal training conducted online,..."
Micro Focus,"UI Software Engineer, Security - Fortify"," DevOps | IT Operations| Cloud | Security | Info Governance | Big Data, Machine Learning, &amp; Analytics. At Micro Focus, everything we do is based on a simple idea..."
Verizon,Senior Manager – Big Data Engineering," What you’ll be doing... As our Senior Manager – Big Data Engineering (Core Services), you will manage a team of Big Data Platform Engineers. You will provide..."
Neudesic LLC,Solution Architect - Digital Platform," Agile, SaFE, Azure PaaS(App Service, Service Fabric, Functions, Logic Apps, SQLDB, DocumentDB, SQL Data Warehouse, Table Storage, Redis Cache, AzureAD,..."
Travelport,Lead Architect - Data Platform," Act as a thought leader in emerging field of data science, AI and Machine Learning; This role also has the responsibility to build technology standards and..."
Reed Business Information,Senior Architect - Diio / Alpharetta," Machine Learning using TensorFlow, Spark MLlib, Scikit-learn. Senior Architect – Alpharetta, GA...."
KPMG,"Manager, Data Science, KPMG Tax Ignition"," Minimum of five years of relevant Analytics, Cognitive / AI, Machine Learning industry experience. Define and develop new Tax solutions leveraging approaches..."
KPMG,"Director, NLP Data Scientist"," Develop innovative data science solutions for Fortune 500 clients that utilize natural language processing, optimization, machine learning, econometric and/or..."
Accenture,FY19Q1 SE Innovation Hub Manager," Work closely with Georgia Institute of Technology faculty and researchers in such domains as Artificial Intelligence, Machine Learning, Advanced Analytics,..."
Capgemini,"Data Scientist - Senior Consultant - Orlando, Florida", Expertise in machine learning algorithms and experience using the following ML techniques:. Design and build scalable machine learning models to meet the needs...
