company,job,summary
Mitre Corporation,Biometrics Graduate Intern," Image processing, pattern recognition, computer vision, machine learning, statistics, biometrics). Do you want to join our over 300 interns for a summer full of..."
"Onyx Government Services, LLC",Statistical Programming Analyst," Demonstrated experience using advanced analytic techniques such as modern econometric methods, machine learning, multivariate statistical analysis, clustering..."
Silverline Communication,B2B Technology Senior Account Executive," Accounts range from cybersecurity, artificial intelligence and machine learning to IoT and automation. Do you have a knack for distilling complex IT processes..."
George Mason University,Research Assistant Professor, Identify potential challenges of applying existing machine learning methods; The successful candidate will perform research in the area of Applied Machine...
2U,Data Science Associate," 2U’s Data Science team is tasked with delivering company wide business intelligence, while partnering with individual business units to identify, build, and..."
Booz Allen Hamilton,"Data Scientist, Junior"," Are you fascinated by the possibilities presented by the IoT, machine learning, and artificial intelligence advances?..."
U.S. Federal Government,Computer Engineer, Maintains governance over VOA's Machine Learning planning and processes; The Engineer is a thought leader and hands-on practitioner partnering with both...
Verizon,Product Management Manager, Familiarity with big-data systems and machine learning. What you’ll be doing......
Inovalon,Data Visualization Developer," Demonstrated algorithm development experience including knowledge of Tableau, statistical and matrix processing techniques, machine learning, data mining, data..."
Elder Research Inc,Business Development Manager - Arlington," Selling innovative technology services such as machine learning, text mining, and graph analytics models and solutions to solve business problems...."
FWG Solutions Inc,Full-Stack Application Developer (Intern), Integrate machine learning algorithms into production-level application code. Ability to migrate Machine Learning findings on dashboard and evaluate performance...
"Reinventing Geospatial, Inc.",Machine Learning Software Engineer," Data analytics and Machine Learning. The candidate will be responsible for researching, developing, testing, and evaluating various datamining and machine..."
Hatch,Data Science Specialist," Use machine learning methods (e.g., cluster analysis, decision trees, random forest, neural networks, logistics regression) to model and predict business..."
NPR,Digital Analyst," Familiarity with academic statistics concepts, tests for significance, regression analysis, and machine learning concepts...."
Mitre Corporation,Data Scientist," Experience applying various machine learning approaches (e.g., random forest, neural networks, support vector machines). Data Scientist - (00050956)...."
Leidos,Machine Learning (ML) Senior Researcher, PhD in Machine Learning or Artificial Intelligence with publication track record. Advanced degree in machine learning (Ph.D highly desired) or a related...
Amazon.com,Sr. Data Scientist," Strong working knowledge of deep learning, machine learning and statistics. Experience with statistical modelling / machine learning...."
"Medical Science & Computing, Inc.",Computational Image Analysis and Data Processing Manager, Categorize and analyze data sets via neural networks and associated deep learning technologies (including but not limited to Google’s TensorFlow library)...
The College Board,Data Scientist," Strong foundation in statistical analysis and machine learning techniques. Use various modeling techniques, network analysis, and machine learning techniques to..."
GEICO,Senior Data Scientist," A minimum of 3 years of experience in data mining, machine learning and distributed computing is required...."
"Medical Science & Computing, Inc.",Imaging Specialist," Apply machine learning, deep learning, data mining, and image processing techniques to extract meaningful information from existing infectious disease portal..."
The Johns Hopkins Applied Physics Laboratory,Robotics Post-Doctoral Researcher," Machine perception, dexterous manipulation, mechanical design and fabrication, advanced controls, artificial intelligence, machine learning, and experience with..."
Adobe,Senior Manager Government Relations," Through collaboration and advocacy, we are increasing government’s understanding of the new tools of Artificial Intelligence and Machine Learning...."
Foreground Security,Principal Investigators – High-Tech Research," This position requires the eligibility to obtain a security clearance. Except in rare circumstances, only U.S. citizens are eligible for a security clearance..."
US Agency for International Development,Data Scientist," Solve difficult, non-routine problems in natural language processing and machine learning. Use predictive analytics and/or machine learning to facilitate..."
MicroStrategy,"Director, Advanced Technology Programs - Machine Learning & AI", Background in Machine Learning through actual implemented projects (in school and/or in practice). Director of Machine Learning Programs is a hands-on role –...
Personnel Decisions Research Institutes LLC,Senior Research Scientist," Knowledge of text analytics, natural language processing, and machine learning preferred. PDRI, an SHL Company is currently looking for an experienced..."
Choice Hotels,Senior Analyst Predictive Analytics," Experience using inferential statistics, geospatial analysis, machine learning algorithms is a plus. Predictive Modeling “Center of Excellence” will focus on..."
Guru,Data Engineer," In this role, you will be responsible for leveraging open source tools for extracting, transforming, and loading data between databases, as well as providing..."
ECS Federal LLC,Scientist-Engineer," Areas of interest include, but not limited to contemporary machine learning algorithms and applications and neural networks...."
"Medical Science & Computing, Inc.",Computational Image Database Manager, Knowledge of parallel programming techniques to categorize and analyze data sets via neural networks and associated deep learning technologies (including but...
"Medallia, Inc.","Senior Software Engineer, Machine Learning", Experience with Machine Learning workflows. Experience with Machine Learning frameworks such as TensorFlow....
Novetta,Data Scientist," Demonstrated experience with augmented intelligence, anticipatory intelligence, and machine learning. Are you passionate about solving challenging problems?..."
RiskSpan,Sales Executive," Our services include Predictive Analytics, Data Management, Data Governance, Model Governance, Asset Valuation and Machine Learning for Mortgage Finance...."
Amazon.com,"Principal Specialist Sales, Database and Analytics"," Create &amp; articulate compelling value propositions around AWS database, analytics, and machine learning services...."
Deloitte,Data Scientist, Demonstrated knowledge of machine learning techniques and algorithms. From on-the-job learning experiences to formal development programs at Deloitte University...
General Electric,Staff Data Scientist," The Staff Data Scientist will work in teams addressing statistical, machine learning and data understanding problems in a commercial technology and consultancy..."
Freddie Mac,Data Analytics Senior," Have experience using R, Python, or other scripting languages for data prep, analysis, and machine learning. Learning how data is crucial to the success of any..."
i_SW Corp,Scientist-Engineer," Areas of interest include, but not limited to contemporary machine learning algorithms and applications and neural networks...."
The Johns Hopkins Applied Physics Laboratory,Advanced Concepts Analyst," Be a part of a fast-paced, innovative group employing cutting-edge analytic techniques to some of the nation’s most critical challenges. Participate in..."
BAE Systems,Principal Machine Learning Research Scientist," Doctorate in Computer Science or Engineering-related discipline with or without professional experience (specialization in Machine Learning, Statistics,..."
KPMG,"Associate - AI, NLP, and Platforms Consultant"," Understanding of data preparation, machine learning, deep learning, natural language processing; Leverage a variety of tools and approaches to solve complex..."
Praxis,Roboticist," Develop and implement dynamically stabilized robotic locomotion algorithms, to include model-predictive control-based algorithms, linear or non-linear based..."
CGI,Statistician," Advanced statistics and machine learning/NLP techniques and algorithms using R, Python, Java on ML platforms such as Spark, H20 etc...."
MicroStrategy,Predictive Analytics Services Program Leader," Experience with one or more predictive analytics technologies including ""R"", Python or other AI / Machine learning tools...."
Deloitte,Robotics & Intelligent Automation Specialist, Experience with machine learning and natural language processing solutions. From on-the-job learning experiences to formal development programs at Deloitte...
Freddie Mac,Quantitative Analytics Professional, Programming experience with R or Python Machine learning libraries. Applying statistical and machine learning techniques to address business and modeling...
K12,Forecasting Manager, Experience working with machine learning (ML) and regression-based forecasting approaches. This person will join a cutting-edge Business Analytics team and...
National Security Agency,Computer Science Intern Program, Machine Learning/Artificial Intelligence. The Computer Science Intern Program (CSIP) is an intense and exciting 12-week immersive internship open to select...
"Marriott International, Inc","Vice President, Data Domain Management", Deep understanding of the Advanced analytics and related data pipelines and operationalization at scale of machine learning model....
ZyLAB,Data Science Graduation Program and Internships," We are a global leader in the development of award-winning search, text-mining, machine learning, and other artificial intelligence technology...."
comScore,Statistical Analyst," Familiarity with Bayesian inference, MCMC methodologies, generalized linear models, and machine learning (advanced clustering and classification methods)...."
Mitre Corporation,Information Scientist," Data analysis experience using machine learning, managing massive data volume and velocity, information cleansing &amp; refinement, information models &amp;..."
Booz Allen Hamilton,Neuroengineering and Neurotechnology Consultant," Experience with neuro-engineering, biomedical engineering, neuroscience, electrical engineering, materials science, machine learning, or a related field...."
Leidos,Machine Learning Systems Engineer," Machine learning, artificial intelligence, computer vision, or autonomy. Apply machine learning tools, algorithms, and techniques to RF systems...."
Workbridge Associates,Security Analyst, The company develops AI and Machine Learning software that is used to help solve problems in cybersecurity and cyber terrorism....
George Washington University,"Senior Research Associate, Bioinformatics Genomics", Ability to apply statistical and machine learning techniques to solve “big data” problems. Antibiotic Resistance Action Center at George Washington University...
In-Q-Tel,"Data Engineer, Lab41", Working alongside Data Scientists to productionalize advanced computer science algorithms like machine learning and natural language processing....
GEICO,Big Data Developer, You will be working closely with data consumers and source owners to create the foundation for data analytics and machine learning activities....
Howard University,Assistant Professor (Temp) - College of Engineering & Architecture, The Department of Electrical Engineering and Computer Science at Howard University invites applications for one tenure-track position at the Assistant Professor...
KPMG,"Machine Learning Engineer, Manager"," Innovate. Collaborate. Shine. Lighthouse — KPMG's Center of Excellence for Advanced Analytics — has both applied data science, AI, and big data architecture..."
BAE Systems,Data Scientist," These include, but not limited to, Comparison of Means, ANOVA, variable reduction, segmentation/clustering techniques, predictive modeling and Machine Learning..."
ABSc,Data Scientist," Programming languages, statistics/math packages, computer science, machine learning, or scientific computing;..."
FEDDATA,Data Scientist," Experience with predictive analytics, machine learning, and data mining. Performs and manage the activities of Contractor principal engineering personnel...."
AECOM,Data Strategist I, They will help establish the vision and strategic capability to enhance the company's performance on contracts by effectively leveraging machine learning...
The Johns Hopkins Applied Physics Laboratory,Neural Signal Processing Researcher," Demonstrated ability in developing machine learning algorithms and neural signal processing tools using Matlab, Python and/or C/C++...."
Society for Human Resource Management (SHRM),Data Scientist," Advanced proficiency in R and/or Python programming, including machine learning and data visualization tools (Scikit-learn, R packages for machine learning &amp;..."
Exabeam,Technical Account Manager - US Federal," The Exabeam Security Intelligence Platform uniquely combines a data lake for unlimited data collection at a predictable price, machine learning for advanced..."
Draper,Machine Intelligence Scientist/Engineer," Expert in computational modeling and/or machine learning, algorithm development, data analytics. In computer science, machine learning, statistics,..."
TPC Energy Fund,Streaming Data Engineer," Relevant research experience, such as a PhD, Masters, or Architect Role in Math, Computer Science, Physics, Machine Learning or a relevant quantitative field...."
LOCKHEED MARTIN CORPORATION,Human Systems Modeling Engineer, Experience with applying machine learning techniques and neural networks to problem sets. Candidate will support modeling work (deriving machine learning...
In-Q-Tel,SQL Server Engineer," We are looking for engineers who bring fresh ideas from all areas, including development processes, information retrieval, workflow tuning, UI design, and..."
Jobspring Partners,Scrum Master," Title: Scrum Master Job Description A Digital Solutions company in Washington, D.C. is looking to onboard a Scrum Master to join their team. This team..."
Metron Scientific,Research Scientist," Job Description Our Unmanned Systems group is looking to add a talented Research Scientist with a background in autonomous systems, artificial intelligence,..."
"Metron, Inc.",Research Scientist," Job Description Our Unmanned Systems group is looking to add a talented Research Scientist with a background in autonomous systems, artificial intelligence,..."
"Harmonia Holdings Group, LLC.",Senior Data Scientist, 4+ experience with data wrangling and machine learning algorithms and libraries. Harmonia is currently looking for smart and self-motivated Senior Data...
George Mason University,Postdoctoral Research Fellow," The incumbent should have research experience with programming and scripting languages (C++, Java, R, MatLab) and working knowledge of network neuroscience,..."
USC,Postdoctoral Scholar Research Associate - Reconfigurable Computing," Experience with Machine Learning and/or Graph partitioning algorithms targeting FPGAs or ASICs. These tools solve challenging problems in hardware security,..."
Area 1 Security,Security Engineer," We hunt at scale with high-speed web crawling, machine learning, computer vision, petabytes of data, and a global network of sensors...."
Giant Oak,Social Scientist/Subject Matter Expert I," Experience with applied machine learning (anomaly detection methods desired) along with NLP, IE, and ETL methods...."
USC,Computer Scientist - EDA Algorithm Researcher," These tools solve challenging problems in hardware security, high level abstraction for hardware design, and machine learning acceleration for critical systems...."
AstraZeneca,Solution Architect (Search & Taxonomy)," Machine Learning e.g. SPARK. Solution Architect (Search &amp; Taxonomy) – Gaithersburg, MD...."
"Medical Science & Computing, Inc.",Data Science Expert," Biomedical Image Informatics, coupled with machine learning, especially deep learning models, has seen significant growth in recent years as an integral part of..."
Engility,Computer Scientist," Machine learning tools and techniques (e.g. Computer Science (can be specialized in Algorithms, Combinatorics and Optimization, Artificial Intelligence or..."
"National Technologies Associates, Inc.",Data Science & Tagging Analyst," Creating and using advanced machine learning algorithms and statistics (regression, simulation, scenario analysis, modeling, clustering, decision trees, neural..."
Deloitte,Robotics & Intelligent Automation Manager, Experience with machine learning and natural language processing solutions. From on-the-job learning experiences to formal development programs at Deloitte...
Booz Allen Hamilton,Operations Research Analyst/Data Scientist," Are you fascinated by the possibilities presented by the IoT, machine learning, and artificial intelligence advances?..."
AvalonBay Communities,Data Scientist, Work with data engineering and IT to productionize machine learning solutions. Lead implementation of business solutions based on modeling and machine learning...
K12,Data Scientist," Expertise in Python or R for statistical modeling, machine learning, procedural model development, and analysis. Sr...."
Fractal Industries,Front-End Engineer (Javascript)," Our Human+AI operating system, Fractal | OS™, blends capabilities ranging from data handling, analytics, and reporting to advanced algorithms, simulations, and..."
Amazon.com,Solutions Architect - Kinesis Specialist," These engagements will focus on Real Time and Batch-based Big Data processing, Business Intelligence, and Machine Learning...."
KEYW Corporation,Computational Linguist III," Experience with machine learning. Minimum 6 years experience in statistical machine translation engine training, requirements analysis, software development,..."
Qlarion,Data Engineer," Experience configuring machine learning toolkits including but not limited to TensorFlow, keras, and scikit-learn...."
Kite Pharma,"Senior Research Associate, Bioinformatics"," Strong familiarity with single-cell data sets, transcriptome analysis, genetic screening platforms and machine learning is a clear advantage...."
Noblis,Splunk Developer," Development of statistical behavior models, and support for the development of machine learning approaches. As part of the design and implementation effort, the..."
The Johns Hopkins Applied Physics Laboratory,Imaging System Analyst, Help define metrics for all aspects of the system from evaluation of hardware readiness to evaluation of information processing and machine learning systems....
ManTech International Corporation,CTCEU Statistical Data Analyst," Previous experience using R, Matlab, Python Scikit-learn or other statistical modeling packages, with a focus on machine learning;..."
Booz Allen Hamilton,Research Data Scientist," Ability to perform innovative machine learning research and software development. Are you fascinated by the possibilities presented by the IoT, machine learning..."
Workbridge Associates,Data Scientist, Experience with Machine Learning tools. Ideal candidate also has strong SQL programming skills and some experience with Machine Learning tools and Big Data....
Gallup,Data Engineer," Ongoing learning and development opportunities. Minimum of at least one year experience in the fundamentals of machine learning and statistics, with an emphasis..."
Next Century Corporation,Software Engineer (Image Processing)," Image/video processing, GIS, machine learning. Demonstrated passion for learning and curiosity of the world...."
CACI,Software Engineer," Current active projects involve technologies including Angular, AWS, and machine learning. CACI has an opening for a software engineer on our product team..."
Advantage SCI,Data Scientist, Demonstrates ability to extract meaning from and interpret data using a variety of tools and methods from statistics and machine learning....
Society for Human Resource Management,Data Scientist," Advanced proficiency in R and/or Python programming, including machine learning and data visualization tools (Scikit-learn, R packages for machine learning &amp;..."
UiPath,US Public Sector Sales Executive," 5+ years of experience in selling enterprise IT solutions (BI, data analytics, machine learning,BPM and Artificial Intelligence)...."
Addx,Statistical Programmer," Must have 2-4 years of experience with the programming tools Srata, Python , Tableau, machine learning expertise...."
Endgame,Senior Threat Researcher, Knowledge or experience of machine learning applied to the information security domain is a plus. Demonstrable passion for cyber security including continual...
Verizon,Director Product Engineering," Deep knowledge of applying analytics, Machine learning and AI in enhancing the management of networks to drive better customer experience...."
DECISIVE ANALYTICS Corporation,Mathematical Programmer," Experience in applying core Machine Learning methodologies is a plus:. Regression, Bayesian classifier, Clustering, Matrix Factorization, k-Nearest Neighbors,..."
"NCI Information Systems, Inc.",Program/Cost Analyst (ACEIT)," Explore new ways to analyze data using statistical methods, machine learning and predictive models. NCI is a leading provider of enterprise solutions and..."
Leidos,Data Science & Tagging Analyst," O Creating and using advanced machine learning algorithms and statistics (regression, simulation, scenario analysis, modeling, clustering, decision trees,..."
Booz Allen Hamilton,"Data Scientist, Mid"," Are you fascinated by the possibilities presented by the IoT, machine learning, and artificial intelligence advances?..."
CACI,Client Executive - Homeland & National Defense," Decision Support solutions including machine learning, Artificial Intelligence, and mobile application development to improve both tactical and strategic..."
C3 IoT,Data Scientist (Federal)," Specialization in machine learning preferred. Machine learning (deep learning, large-scale optimization, probabilistic inference, etc.), Natural language..."
The Rock Creek Group,IT Senior Engineer," Rock Creek is looking for a Senior Full-stack Developer interested in Finance, Data Visualization and Machine Learning...."
Altamira Technologies Corporation,Data Architect," Beyond that, because Data Engineers focus more on the design and architecture, they are typically not expected to know any machine learning or analytics for big..."
Institute for Defense Analyses,Research Analyst - Data Scientist," Experience in machine learning and predictive analytics is required. Training in statistics, simulation, deep learning, text analytics is desired...."
Kinetica DB,Software Engineer (Python)," Passion for Machine Learning and Data Science. Exposure to one machine learning open source package (sklearn, TensorFlow, Caffe2, Torch, etc.)...."
Leidos,Sr. Systems Engineer (Bethesda or Reston)," The DOMEX Data Discovery Platform (D3P) program is a next generation machine learning pipeline platform that will provide cutting edge data enrichment, triage,..."
DECISIVE ANALYTICS Corporation,Senior Machine Learning Software Engineer," We are seeking applicants with strong software development skills, and experience in machine learning to join our team...."
Booz Allen Hamilton,"Data Analyst, Junior"," Are you fascinated by the possibilities presented by the IoT, machine learning, and artificial intelligence advances?..."
Booz Allen Hamilton,Java Developer," Are you fascinated by the possibilities presented by the IoT, machine learning, and artificial intelligence advances?..."
"NCI Information Systems, Inc.",Program Analyst/Cost Analyst (A)," Explore new ways to analyze data using statistical methods, machine learning and predictive models. NCI is a leading provider of enterprise solutions and..."
Vintun LLC,Data Scientist," Selecting features, building and optimizing classifiers using machine learning techniques. Excellent understanding of machine learning techniques and algorithms..."
Raytheon,Python Developer/Researcher," Develop software in Python for the analysis of cybersecurity data along with wireless network communication and processing features using machine learning, risk..."
Concurrent Technologies Corporation,Principal Machine Learning Forensic Analyst," PRINCIPAL MACHINE LEARNING FORENSIC ANALYST. Familiarity with machine learning deep learning libraries such as TensorFlow, Theano, MXNet, Dlib, or..."
Octo Consulting Group,Sr. IT Strategy Consultant," Research, identify, and evaluate emerging technology solution alternatives and options (e.g., Artificial Intelligence, Blockchain, Machine Learning, Robotic..."
Concurrent Technologies Corporation,Senior Machine Learning Forensic Analyst," SENIOR MACHINE LEARNING FORENSIC ANALYST. Familiarity with machine learning deep learning libraries such as TensorFlow, Theano, MXNet, Dlib, or Deeplearning4j...."
Booz Allen Hamilton,Data Scientist," Knowledge of machine learning, data mining, statistics, or graph algorithms. Are you fascinated by the possibilities presented by the IoT, machine learning, and..."
Mitre Corporation,Biometrics Engineer," Background in biometrics, image/video/signal processing, machine learning and/or statistical analysis. Biometrics Engineer - (00050906)...."
