company,job,summary
"MTEQ, Inc.",Machine Learning SME, Experience gathering data from large information systems. They should have the ability to communicate Data Science concepts to a lay person audience and be an...
"Digital Management, LLC",Research Analyst/Technical Writer," MI is looking for a talented, self starting Research Analyst/Technical Writer to edit white papers and technical documents regarding emerging technologies..."
"Modern Technology Solutions, Inc. (MTSI)",Senior Statistician, Test data analysis. Mastery in data analysis and reduction. Provide test data analysis to programs and portfolios....
SOSi,Research Analyst Level III-Business Intelligence," Company Overview For 29 years, clients in the private and public sectors have relied upon SOS International LLC (SOSi) for critical operations in the world’s..."
Leidos,Sr. Data Science Instructor w/Polygraph," Data Science Instructor will conduct research necessary to develop and revise the data science skills curriculum, as well as tailor learning for unique in-house..."
Radiant Solutions,Machine Learning / Algorithm Developer," Apply machine learning in large data environments. Complete data mining, predictive modeling, clustering, and classification...."
CyberCore Technologies,SME Mid or Sr (Data Scientist), ALL CANDIDATES MUST HAVE AN ACTIVE TS/SCI WITH POLYGRAPH CLEARANCE! Description: Collaborate with product management and engineering departments to...
Inovalon,Business Systems Analyst, Master’s degree plus at least one year of related professional experience (or two years of related professional experience if in possession of a relevant...
NORC at the University of Chicago,Senior Statistician, In Statistics or the social sciences. General familiarity with social science research and policy issues....
Engility,Operations Research Analyst - Program Metrics," 8-15 years of related experience in engineering, science or related field. Engility delivers innovative solutions to critical challenges facing the nation and..."
stanleyreid,"Data Engineer: ETL, Spark - FS Poly"," Our client is a product and services firm, pre-IPO, that specializes in data science and analytics for the federal government and commercial market...."
Intecon,Data Center Cloud Engineer," Intecon is hiring a Data Center Cloud Engineer. Big Data Applications (Hadoop HDFS, Accumulo, Spark, Streaming, Kafka, Cassandra)...."
Booz Allen Hamilton,Machine Learning Engineer, A chance to change the world with the Data Science Bowl—the world’s premier data science for social good competition....
Corporate Brokers,Machine Learning SW Engineer, Work with Trading Data. There is a NEW Data Strategy for our client to enable to solve DATA problems more efficiently....
Leidos,Senior Data Scientist," Ability to interpret and evaluate the results of data science community’s methods models and/or algorithms, understanding the meaning, limitations and scope of..."
IBM,Machine Learning/Computer Vision Consultant," IBM Global Business Services (GBS) is a team of business, strategy and technology consultants enabling enterprises to make smarter decisions and providing..."
"Apogee Integration, LLC",Business Analytics Data Engineer, Assist in construction of data sets and data views for use by the data analytics team to display complex data sets in a meaningful way....
"MacAulay-Brown, Inc. (MacB)",Security Research Analyst (Expert), Demonstrated ability to extract data contained in large databases and analyzes that data to derive meaningful information....
Probity Inc.,"Software Engineer - Data Engineer, ETL", The Data Engineer will manipulate data and data flows for both existing and new systems. He or she much also have experience with the principles of large-scale...
eGlobalTech,Technical Manager (Machine Learning)," Degree in research and/or science desirable. Experience in a science, medical, grants and/or research industry...."
SOSi,Research Analyst Level II-Military Intelligence Analyst," Provide record checks, data research and social networking analysis through the use of intelligence and law enforcement databases and search engines...."
"MTEQ, Inc.",Machine Learning Engineer, A strong understanding of big data concepts and knowledge of big data languages/tools. BS or MS degree in Computer Science with a specialization in Machine...
AARP,"Web Analyst and Technical Editor, AARP Research"," Business Unit Description AARP is a nonprofit, nonpartisan organization, with a membership of nearly 38 million that helps people turn their goals and dreams..."
stanleyreid,Data Scientist: sole-source Prime - FS Poly," Cjobs-cat:""IT - Data Science"". Professional focus on Data Science, Statistics, Machine Learning, NLP, Predictive Modeling, or similar discipline...."
"Semper Fortis Solutions, LLC",General Military Intelligence Analyst (GMIA) Research Analyst Level III," Overview Semper Fortis Solutions, LLC (SFS) is looking for individuals with experience as intelligence analysts with clear experience performing tasks..."
NORC at the University of Chicago,Senior Research Analyst, Bachelors’ Degree in Social Science or Behavioral Science; NORC’s Health Sciences staff produce rich data on social priorities including child development and...
AMERICAN SYSTEMS,Operations Research Analyst / Statistician, Analyze environmental data and impacts on real world platforms and sensors. Minimum six (6) year of experience with statistical methods applied to large output...
Red Ventures,"Technical Support Analyst - NOC (Charlotte, NC)"," Through bespoke technology, integrated digital commerce and sales, distinguished partnerships, data science and original content from the company’s proprietary..."
The Execu|Search Group,Research Assistant / Analyst, 1+ year of experience in Research and Data Collection. About the Opportunity....
Department of Commerce,"Senior Level, Chief Patent Statistician", Producing innovative solutions driven by exploratory data analysis from complex and high-dimensional data sets....
Booz Allen Hamilton,"Data Engineer, Senior"," Data Engineer, Senior. Design, build, and deploy efficient and reliable data pipelines to move data, both large and small amounts, to the data platform...."
stanleyreid,Data Scientist: Machine Learning - FS Poly," Cjobs-cat:""IT - Data Science"". Professional focus on Data Science, Statistics, Machine Learning, NLP, Predictive Modeling, or similar discipline...."
Systems Planning and Analysis,Operations Research Analyst," Compiling and assembling data; Duties will include data mining; Experience with Data Analysis systems/language (MATLAB, SAS, S-Plus, R, Python, CPLEX, Visual..."
Praxis Engineering,Sr Data Scientist," M.S or PhD degree in quantitative or technical field of study (e.g., statistics, mathematics, computer science, physical science, quantitative social sciences)...."
Engility,Statistician /Data Scientist 4 - Data Modeler," Bachelor of Science degree in statistics, mathematics, image science, remote sensing, earth science, physical science or related technical or scientific field..."
SOSi,Research Analyst Level III-Force Modernization," Company Overview For 29 years, clients in the private and public sectors have relied upon SOS International LLC (SOSi) for critical operations in the world’s..."
Comcast,Senior Software Engineer - Big Data," BS in Computer Science, Computer Engineering or related technical field. Comcast brings together the best in media and technology...."
AstraZeneca,Senior Principal Statistician, Report to Statistical Sciences Group head or an associate director or above. Limited supervision by Statistical Sciences Group head or an associate director or...
Finra,"Senior Data Engineer - Technology - Washington, DC"," Once the data is acquired, you will also cleanse and assemble the data as per the economist’s needs. Experience with Big Data platforms (Spark preferred)...."
Leidos,Software Engineer/Data Scientist, The Data Scientist will leverage latest technologies to perform automated DevOps Continuous Integration and Continuous Delivery of software....
BrainTrust Holdings,SME Mid or Sr (Data Scientist) (CT) 4987-CTS TTO 762, Required Skills: • Collaborate with product management and engineering departments to understand company needs and engineer storage requirements • Design...
"MacAulay-Brown, Inc. (MacB)",Research Analyst/ Counterintelligence & Law Enforcement Support - Level II," Experience providing research and analysis in support to counterintelligence (CI) and CT investigations, to include analysis/review of investigations, exchange..."
Parsons,Software Engineer II / Big Data, Then come join our Integrated Data Services team in developing innovative capabilities to help mission navigate and understand data....
Varen Technologies,Self-Starter Cloud Engineer / Big Data Analytic Developer," Mandatory Skills -8+ years of experience-familiarity with open source big data technologies -US Citizenship Required (TS/SCI preferred, not required )...."
Level One Personnel,Lead Data Scientist, Lead Data Scientist. We are looking for a data scientist with experience in big data structuring to compile a large disparate data source into a modern solution...
Mitre Corporation,"Data Management Systems Engineer, Lead"," Database design, legacy data migration, logical data modeling, physical data modeling, master data management, data sharing and integration, and data strategy..."
OGSystems,Senior Data Scientist," Experience conducting data discovery, data analysis, and reporting of large volumes of data sources. The Data Scientist will use expertise and experience for..."
Alaka`ina Foundation Family of Companies,Senior Analyst/Research Specialist," Implement data models, database designs and data access business rules to ensure that analysts, data miners and developers can utilize data effectively...."
Leidos,CI/Security Research Analyst - Personnel Security Analyst, Demonstrated ability to extract data contained in large databases and analyze that data to derive meaningful information....
Redfish Technology - High Tech Executive Recruiter...,Pre-Sales / Solution Engineer - Big Data/Semantic Intelligence Software," #22290 Pre-Sales / Solution Engineer - Big Data/Semantic Intelligence Software Location: Rockville, MD, 20852 Industry: Internet, Computer Software,..."
Coverent,Data Scientist with TS/SCI & CI POLY," Ability to simultaneously understand computer science concepts, data context, and mission objectives while completing projects. Manipulate large data sets...."
CGI,Senior Statistician," Conduct relevant research, data analysis, and create reports. Prior experience using financial data and with federal consulting...."
Blue Sky Innovative Solutions,Data Extraction Engineer, Data Extraction Engineer. Work closely with Direct Operations and Software Development teams to integrate data mining and Natural Language Processing (NLP) into...
Splunk,Splunk Machine Learning & Analytics SE Architect," Prototypes can be in the form of Splunk Apps, data sources, data stores, visualizations, automation, tools, etc...."
Leidos,Bioinformatics Analyst (NCI)," Experience in multi-omic data integration and complex data visualization. This position is within the Advanced Biomedical and Computational Sciences (ABCS),..."
Kite Pharma,"Senior Scientist, Research-Product Science Liaison for T cell Therapy", Serve as a key link between Research and Product Sciences Group jointly developing a process to manufacture fully personalized T cell therapies....
TDI,Senior Full Stack Software (Data) Engineer, Extensive knowledge working with complex data sets and developing PostgreSQL queries. Bachelors degree in Computer Science or equivalent discipline from an...
"Syntelligent Analytic Solutions, LLC",Data Management Engineer-SME, Experience with data science methodologies (amount of familiarity will drive position level). As a member of the Document and Media Exploitation (DOMEX) Data...
SOSi,Research Analyst III -Collection Management and Dissemination," Company Overview For 29 years, clients in the private and public sectors have relied upon SOS International LLC (SOSi) for critical operations in the world’s..."
Booz Allen Hamilton,"SIGINT Data Scientist, Senior"," SIGINT Data Scientist, Senior. MS degree in Mathematics, Computer Science, or Engineering. 3 years of experience with research in statistics, mathematics, or..."
Oracle,Principal Software Engineer - Oracle Data Cloud, Use efficient data structures and algorithms to enable data processing at scale. SENIOR JAVA ENGINEER - Data Cloud....
"Consulting Services Group, LLC",Senior Data Scientist/Architect," Senior Data Scientist/Architect - McLean, VA. Strong knowledge of software engineering best practices and computer science...."
SAIC,Chief Data Scientist Solution Architect Job, The Chief Data Scientist plays a leadership position in the data science department and is responsible for overseeing activities of the junior data science team...
Mitre Corporation,"Lead Computer Scientist, Data Analytics"," In Computer Science, Data Science, Applied Mathematics/Statistics, Operations Research, or other physical science/engineering fields...."
stanleyreid,Data Scientist: Cybersecurity - FS Poly," Cjobs-cat:""IT - Data Science"". Professional focus on Data Science, Statistics, Machine Learning, NLP, Predictive Modeling, or similar discipline...."
CareFirst BlueCross BlueShield,Senior Big Data Engineer," 3+ years of Big Data development and Data Engineering experience. BA/BS in Computer Science, Engineering, Math, Acturial Science, Information Systems, or other..."
SAIC,Data Engineer Architect Job, Data architect positions provide strategic guidance to data stewards on the development and implementation approaches for data models to support organizational...
stanleyreid,Data Scientist: Counterintelligence - FS Poly," Cjobs-cat:""IT - Data Science"". Professional focus on Data Science, Statistics, Machine Learning, NLP, Predictive Modeling, or similar discipline...."
BAE Systems,Full Stack Developer (Mid) - Java Data Visualization Engineer," Bachelor’s degree in Engineering, Computer Science, or other related analytical, scientific, or technical discipline is preferred...."
ANSER,Sr. Project Execution and Technical Support Analyst," Data science, artificial intelligence, deep learning systems,. A bachelor’s degree in engineering, computer science, physics, or other science and technology..."
Jacobs,Big Data Systems - Systems Engineer - IRES - Ft. Belvoir, The Big Data Systems System Engineer will work on the IRES Program supporting the Missile Defense Agency....
The Johns Hopkins Applied Physics Laboratory,Systems Analyst," Proficiency with Python data science libraries (e.g. BS degree in Computer Science, Computer Engineering, Mathematics, Electrical Engineering or related field...."
KPMG,"Big Data Software Engineer, Senior Associate"," Implement and test data processing pipelines, and data mining / data science algorithms on a variety of hosted settings, such as AWS, Azure, client technology..."
KPMG,"Senior Associate, Big Data Software Engineer"," Implement and test data processing pipelines, and data mining / data science algorithms on a variety of hosted settings, such as AWS, Azure, client technology..."
Leidos,Data Scientist/Architect with Polygraph," The Data Architect will be expected to build statistical models, test hypotheses, interpret, summarize, visualize, and succinctly report on data holdings...."
Jacobs,Data Analytics Analyst - TS/SCI with poly," Experience with data analytics, data visualization, data science, statistics and/or economics. Data analysis in MS Excel and other data visualization tools such..."
"Apogee Integration, LLC",Tableau Visualization Consultant and Data Analyst (Active TS/SCI)," SQL and Big Data Experience:. Techniques useful in big data analytics:. Assist customers with analyzing complex data sets, and developing prototypes and..."
Guidehouse,Operations Research Analyst - Senior Associate," Data and systems interactions including IT tools and technology. PwC Public Sector, LLP helps federal, state, and local governments solve complex business..."
"MacAulay-Brown, Inc. (MacB)",Research Analyst/ Force Modernization Support - Level III," Experience providing research and analysis in support to counterintelligence (CI) and CT investigations, to include analysis/review of investigations, exchange..."
ProObject,Operations Research Analyst III," Develops cost-benefit analysis, data collection, data analysis, risk analysis, simulation model execution, economic analysis, and operational effectiveness..."
OGSystems,NTM:R Data Architect/Systems Engineer - V," MS in Computer science, computer science, data science or related scientific or technical discipline. Experienced with predictive analytics, data visualization,..."
Leidos,Voice Data Engineer-Journeyman, Journeyman level Voice Data Engineer in support of the AFNCR IT Services program at the National Military Command Center (NMCC)....
Diverse Lynx,Machine Learning & Python Developer," Work with data collection, data cleansing, feature engineering, model selection, training, testing, and deployment...."
Firebird AST,Asymmetric Threat Operations Research Support Analyst (ORSA)," Operations Research, Applied Mathematics, Engineering, Science, Computer Science, Mathematics, or Statistics. You will provide actionable, insightful reporting..."
KPMG,"Manager, Big Data Software Engineer"," Architect, implement and test data processing pipelines, and data mining / data science algorithms on a variety of hosted settings, such as AWS, Azure, client..."
stanleyreid,Data Scientist: Risk Analytics - FS Poly," Cjobs-cat:""IT - Data Science"". Professional focus on Data Science, Statistics, Machine Learning, NLP, Predictive Modeling, or similar discipline...."
FM Talent Source,Statistician (ACC-17-00036)," Intermediate or higher level ability to use data analytic software and Excel to conduct analyses, develop data tables for reports, create data visualizations,..."
Concurrent Technologies Corporation,Machine Learning Forensic Analyst," Perform data science tasks related to data retrieval, exploration, manipulation, and transformation. Master of Science degree in a scientific field such as..."
Engility,Lead Operations Research Analyst," Extracting and collecting data, and analyzing data using statistical analysis and data visualization programs such as Excel, Tableau, Stata, R, and Crystal Ball..."
stanleyreid,Data Scientist: Insider Threat - FS Poly," Cjobs-cat:""IT - Data Science"". Professional focus on Data Science, Statistics, Machine Learning, NLP, Predictive Modeling, or similar discipline...."
"Reinventing Geospatial, Inc.",Machine Learning Software Engineer," Graph analytics / Network science. Data analytics and Machine Learning. Geospatial Data Processing (GDAL, OGR, PostGIS)...."
Core One,Target Research and Methodology Development Analyst - TS/SCI with Poly, Ability to employ data mining techniques and tools and data basing skills. Experience with sensitive data repositories....
VariQ,Database Architect Lead/Lead Data Scientist," Strong understanding and expderience in BI/Data Warehouses, Data Marts and Data Lakes. Oracle, SQL Server, NoSQL, PostgreSQL, AWS RDS, Data Cubes...."
Mitre Corporation,Sr. Data Analytics Engineer, Conduct data analysis and data modeling; Data Analytics Engineer - (00050541). Apply a variety of analytical techniques to solve customer challenges to include...
"Quadrint, Inc.",Business Intelligence & Analytics Analyst," Effective candidates should have a grounding in data science, statistics, and be skilled in using data to visually answer questions and tell a story...."
Workbridge Associates,"Senior Software Engineer - C#, Java, Big Data"," Computer Science degree. Big data, including Spark, Hadoop and/or Kafka. Ability to work with multiple languages and big data...."
Mitre Corporation,Software Systems Engineer / Big Data and Machine Learning - 0048490," Bachelor's degree and 3 years of experience in Computer Science, Data Science, Applied Mathematics/Statistics, Operation Research, or other physical science..."
Leidos,Machine Learning (ML) Senior Researcher," Strong data analysis skills using R or a comparable platform, and one programming language, e.g. Python, Perl, C/C++, Java...."
ManTech International Corporation,Senior Data Layer Engineer," Experience with the creation of data warehousing and 2nd tier data models. Experience with databases (Oracle), large scale data analysis, and data ingestion is..."
Inovalon,Senior Business Analyst, Master’s degree plus at least one year of related professional experience (or two years of related professional experience if in possession of a relevant...
"Akima, LLC",Insider Threat/Intel Analyst(Active Top Secret Clearance)," Possess demonstrated capability in big data analytics, data modeling, or data science related to intelligence analysis...."
Peraton,Senior Signals Intelligence Research Analyst, Masters of Science in Computer Science. The successful candidate will not only collect data using a combination of standard intelligence methods and business...
KPMG,"Senior Associate, Federal Data Engineer"," Develop data strategies for ETL, MDM, Data Warehousing, Data Governance and Security. HDInsight, ADLS, Data Lake Analytics, Event Hubs, SQL Data Warehouse...."
CSRA,Systems Engineer (Data) - TS/SCI w/Favorable Poly Required," Engineering &amp; Sciences. Prepare data for analytical &amp; operational use. Provide SE for data services, admin and management including:...."
SAIC,Senior Program Analyst Job," Data science, artificial intelligence, deep learning systems. Bachelor’s degree from an accredited college or university in engineering, computer science,..."
Amtrak,Sr Principal Apps System Engineer - Data Science-90229496 - Washington," In depth understanding of the data modeling, data governance, data quality and data integration. Knowledge of data warehousing concepts including data..."
Oracle,Principal Consultant - Data Architect/Scientist," 10+ years of data architecture, data mining, statistical modeling, and/or machine learning algorithms. Principal Consultant - Data Architect/Scientist-18000S3V...."
Engility,Operations Research Analyst - TS/SCI Cleared, Visualization of data to convey information. Strongly prefer 5 years of experience in data analytics performing:....
SOSi,Research Analyst Level III - Force Protection Threat Analysis," Company Overview For 29 years, clients in the private and public sectors have relied upon SOS International LLC (SOSi) for critical operations in the world’s..."
AstraZeneca,Senior Principal Statistician/Science Associate Director Biostatistics Oncology, Science Associate Director requirements:. Science Associate Director Biostatistics Oncology. Science Associate Director desired skills and abilities:....
ASET Partners,Scrum Master/Business Analyst," Experience collaborating with Data Science, Engineering, Product, and Design. In a world where there is seemingly an infinite number of Government Services..."
AstraZeneca,Senior Statistician/ Principal Statistician," And we’re industry-leading in immunology, protein engineering and translational science. We’re constantly pushing the boundaries of science to deliver life..."
SOSi,Research Analyst Level III-Military Intelligence Analyst-Threat Finance," Provide record checks, data research and social networking analysis through the use of intelligence and law enforcement databases and search engines...."
MicroStrategy,"Director, Advanced Technology Programs - Machine Learning & AI"," Knowledge of common languages and libraries used for data processing in ML (e.g. Interact with Data Scientists, Business Users and Developers on use cases and..."
Dewberry,Senior Geographic Information Systems (GIS) Data Analyst/Scientist Professional," In GIS, Data Engineering, Data Science, Computer science, operation research or any quantitatively related fields, or equivalent professional experience...."
Fannie Mae,Product Analyst III - Robotics Process Automation, Knowledge of data management or data science. Analyzes data and gathered insights to assess market needs and competitive product opportunities....
BAE Systems,Principal Machine Learning Research Scientist, And (2) data analysis. (2) creating prototypes (typically in MATLAB) to support demonstration and evaluation of key algorithmic ideas on (often real) data;...
Oracle,Senior Principal Consultant – Data Scientist/Analyst," Oracle Data Guard. Oracle Big Data Appliance. Identifies what data is available and relevant, including internal and external data sources, leveraging new data..."
Jacobs,Operations Research Systems Analyst – Associate," Produces clear and concise data analysis and conducts trend analyses of various data. Assists test teams during test planning, test execution, data analysis,..."
Engility,Sr. Operations Research Analyst," Extracting and collecting data, and analyzing data using statistical analysis and data visualization programs such as Excel, Tableau, Stata, R, and Crystal Ball..."
Northrop Grumman,Senior Systems/Data Flow Engineer, Understanding of the underlying structure of enterprise data formats. A Bachelor's Degree in Computer Science is highly desired which will be considered...
Freddie Mac,"Development Senior (Senior Data Engineer - Nifi, Spark, Kafka)", Big data engineering mainly data acquisition technology implementations (Nifi &amp; Kafka). Master’s Degree in Computer Science....
The Aerospace Corporation,Sr. Data Analytics Software Engineer," Researching, deploying, and evaluating new data analytics technologies. Web development framework experience for data visualization is a plus...."
