company,job,summary
Array Architects Inc,Artificial Intelligence/Machine Learning Specialist, Machine Learning Specialist. Array Analytics is looking for an Artificial Intelligence/Machine Learning Specialist to build our Pivotal ecosystem with solutions...
Amazon.com,Specialist Solutions Architect - Artificial Intelligence and Machine Learning, Strong expertise with machine learning and deep learning models. 5+ years design/implementation/consulting experience of Machine Learning/AI/Deep Learning...
George Washington University,Senior Research Assistant, Candidates with extensive experience in these areas and machine learning applications are particularly encouraged to apply....
VMD,Data Standardization Specialist, Experience in supervised and non-supervised machine learning skills using large data sets. Are you motivated by the customer mission?...
The Henry M. Jackson Foundation,Research Bioengineer," Should have a proven track record of experience in signal processing, machine learning tools, non-linear dynamics and the analysis of complex and large data..."
Envolve People Care,"Manager, Product Development - Machine Learning", Prior experience in machine learning and its applications. Assess the performance of existing products to ensure they are meeting market expectations....
University of Maryland,Open Rank," The position gives preference to expertise in causal inference, multilevel modeling, quantitative program evaluation, or complex survey data analysis, although..."
Workbridge Associates,Machine Learning Engineer, A financial company that originally started in NYC is expanding to the DC metro area and is looking for a Junior-Mid Machine Learning Engineer....
GEICO,Data Ingestion Analyst, You will be working closely with data consumers of our Big Data platform to create the foundation for data analytics and machine learning activities....
The Johns Hopkins Applied Physics Laboratory,Sr. Machine Learning Researcher," Research experience with advanced machine learning research topics such as deep reinforcement learning, unsupervised and semi-supervised learning, imagination..."
Research Innovations Inc,Vulnerability Researcher," WHAT YOU WILL BE DOING · Reverse engineering across many architectures and platforms, including x86/64, ARM, PowerPC, and others. ·Researching operating..."
Jobspring Partners,Machine Learning Engineer," Strong background in machine learning. Right now, this rapidly expanding division is seeking several Data Engineers/Scientists who have a strong background in..."
Geomni,LiDar Data Specialist (GEOMN)," Using the latest remote sensing and machine learning technologies, Geomni gathers, stores, processes, and delivers geographic and spatially referenced..."
The Headfirst Companies,"Vice President, Education"," Adaptive Learning, Blended Learning, AI/VR, Machine Learning, etc. Brain Based, 21st Century Skills, Personalized Learning, SEL, Developmental Readiness, etc...."
Amazon.com,Data Scientist, Ability to apply Statistical and Machine Learning methods to specific business problems and data. The candidate should be familiar with the state of the art in...
World Resources Institute,"Junior Product Specialist, Global Forest Watch"," Global Forest Watch uses machine learning algorithms and expert analysis to distill satellite imagery, crowdsourced information, and hundreds of open datasets..."
"J Craig Venter Institute, Inc and J Craig Venter S...",Faculty," JCVI is seeking Faculty members at the Assistant/Associate/Full Professor level at our La Jolla, CA and Rockville, MD locations with a strong background in..."
FWG Solutions Inc,Full-Stack Application Developer (Entry-Level), Integrate machine learning algorithms into production-level application code. Ability to migrate Machine Learning findings on dashboard and evaluate performance...
ICF,Scientific Information Analyst," Analyze technical, scientific, and health-related information using natural language processing, data visualization, machine learning, and thesaurus editing..."
Novetta,Machine Learning Research Engineer," Research experience in Machine Learning specific to NLP, Computer Vision, or deep learning. Implement, configure and test machine learning and deep learning..."
National Library of Medicine,Tenure-Track Investigator," NLM seeks to recruit investigators with significant experience in the use of statistical, bioinformatic, machine learning, optimization, and advanced..."
BlueLabs Analytics,DATA ANALYST, Experience building predictive models using regression and machine learning techniques. BlueLabs was formed in early 2013 by senior members of the Obama for...
World Resources Institute,"Junior User Outreach Specialist, Global Forest Watch"," Global Forest Watch uses machine learning algorithms and expert analysis to distill satellite imagery, crowdsourced information, and hundreds of open datasets..."
MicroStrategy,Product Manager - Machine Learning and AI," In this role, you will play a critical role to help us define and deliver against our Machine Learning product vision...."
Software Engineering Institute,Security Engineer (Entry Level) - 2010211, You have been exposed to data science and machine learning techniques. What We Do:....
LOCKHEED MARTIN CORPORATION,"– Human Systems, Human Machine Teaming", Experience with Machine learning techniques and neural networks. We develop machine learning algorithms to assess the current state of an individual in near...
Alarm.com,Product Management Associate," User Interface design, web/mobile development, computer programming, computer networking, IP video recording, video analytics, machine learning, voice..."
The Urban Institute,Entrepreneurial Leader- Research Policy and Analysis," This often includes machine learning for prediction, natural language processing for text data, clustering for finding hidden structure within data, and..."
National Security Agency,Data Scientist - Entry to Experienced Level," Designing/implementing machine learning, data mining, advanced analytical algorithms, programming, data science, advanced statistical analysis, artificial..."
MEDSTAR HEALTH RESEARCH INSTITUTE (MHRI),Data Scientist," 5+ years’ experience with data analysis using SQL, computer programming or a related field with graduate level machine learning courses...."
DECISIVE ANALYTICS Corporation,Machine Learning Software Engineer," A demonstrated interest in machine learning through course work or experience. We are seeking applicants with strong software development skills, and a keen..."
Request Technology,Sr. Machine Learning Dev., Machine Learning Dev. 3+ years experience with machine learning and natural language processing. Utilize expertise in models that leverage the newest data...
GEICO,Pricing Modeling Analyst," Experience with at least one of GLMs, decision trees, or machine learning. As a part of the GEICO team, your job duties will include pulling and cleaning large..."
IBM,Technology Consultant - Public Service Sector," Cloud, mobile, analytics, machine learning, artificial intelligence, open source), tools, techniques, and products for their clients...."
The Urban Institute,Senior Fellow (Executive Office Research)," This often includes machine learning for prediction, natural language processing for text data, clustering for finding hidden structure within data, and..."
University of Maryland,Assistant Professor," We especially encourage applications from candidates with a background in geospatial simulation (e.g., virtual and augmented reality, agent-based modeling),..."
Raytheon,Principal Investigators – High-Tech Research," This position requires the eligibility to obtain a security clearance. Except in rare circumstances, only U.S. citizens are eligible for a security clearance..."
"MTEQ, Inc.",Machine Learning SME," Machine Learning, Deep Learning, Information Retrieval, Image Recognition. Work on client engagements as Machine Learning SME...."
National Security Agency,Mathematician - Entry/Mid-Level, Desire for continual learning. The professionals at the National Security Agency (NSA) have one common goal:....
The Henry M. Jackson Foundation,Research Associate III," Experience implementing mathematical algorithms in prototype software, such as MatLab, ImageJ, IDL, Python or R and machine learning algorithms...."
IBM,Cognitive & Analytics Consultant- Public Service Sector," Additionally, experience from coursework or projects using Machine Learning and/or Natural Language Processing...."
George Washington University,Post Doctoral Scientist," Computer systems (operating systems, distributed systems, GPUs, HW-SW co-design, etc.), computer security (cloud, OS, mobile, web, etc.), and machine learning..."
LOCKHEED MARTIN CORPORATION,HR Data Science Intern," Experience using simulation tools, machine learning, time series analysis, and text analytics. The Human Capital Data Science Intern works to provide data..."
"Envistacom, LLC",Threat Finance, The TF SME contractor shall have proficiency and experience with applied data processing and scientific analysis of large datasets and machine learning....
Google,"Program Manager, Maintenance Excellence, Global Data Centers"," Manage, investigate and deploy new maintenance technologies to gain operational efficiencies (CMMS, automation, machine learning, etc.)...."
Federal Reserve Board of Governors,Operational Risk Analyst - Division of Supervision and Regulation," Emerging technologies (e.g., artificial intelligence and machine learning); The Financial Institution and Policy Analyst performs in-depth analyses and risk..."
Radiant Solutions,Machine Learning / Algorithm Developer, Apply machine learning in large data environments. Full-time senior-level Machine Learning / Algorithm Developer will perform a broad range of complex Machine...
Corporate Brokers,Machine Learning SW Engineer, It is a SW Engineering role with Machine Learning. If the right candidate had Deep Learning concepts (Algorithm using Neural Networks) that would be a plus but...
"Cylance, Inc.",Enterprise Sales Manager," By successfully applying artificial intelligence and machine learning to crack the DNA of malware, Cylance has redefined the endpoint protection market,..."
Freddie Mac,"Machine Learning & Distributed Ledger, Development,Senior"," Utilize expertise in models that leverage the newest data sources, technologies, and tools, such as machine learning, Python, Hadoop, AWS, as well as other..."
DECISIVE ANALYTICS Corporation,Entry Level UI Engineer, Work collaboratively with a multi-disciplinary team to provide intuitive user interfaces and data visualizations for complex machine learning algorithms....
eGlobalTech,Technical Manager (Machine Learning)," Analyze technical, scientific, and health-related information using natural language processing, data visualization, machine learning, and text mining tools...."
CrowdStrike,Digital Campaign Writer," Today, the company continues to drive major innovations around AI/machine learning, behavioral-based prevention and detection, etc. to stay ahead of adversaries..."
Institute for Defense Analyses,Research Analyst - Quantitative Social Science, Experience with machine learning techniques and large data sets is a plus. What will you gain?...
Optoro,Data Scientist," Deep understanding of data analysis, machine learning, and data communication across multiple domain areas...."
VF Corporation,Digital Marketing Manager, You will have the opportunity to work cross functionally with all VF’s B rands and outside agencies to build content that is relevant for brand authenticity...
National Security Agency,Engineering and Physical Sciences Researcher - Mid/Experienced Level, Neuromorphic Computer/Machine Learning Applications. Ideal candidates are those with a desire for continual learning and possess strong problem-solving and...
Galois Inc.,Researcher/Principal Investigator," Artificial intelligence and machine learning (including deep learning and decision making, reinforcement learning, automated planning and anomaly detection)...."
BlueLabs Analytics,SURVEY RESEARCH MANAGER, Experience building predictive models using regression and machine learning techniques. BlueLabs was formed in early 2013 by senior members of the Obama for...
Google,"Field Marketing Manager, Google Cloud"," With strong Google differentiation in data analytics and machine learning, security, application development and collaboration software, we’re well on our way -..."
Logistics Management Institute,University and Partner Outreach Leader," Manage relationships with a broad range of academic partners to include the areas of data analytics, machine learning, autonomous systems, innovative logistics..."
Kinetica DB,Sr. Systems Engineer (Distributed Machine Learning)," Interest in Machine Learning and Data Science. Exposure to one machine learning open source package (sklearn, TensorFlow, Caffe2, Torch, etc.)...."
SentinelOne,Enterprise Sales Representative," Our unique approach is based on deep inspection of all system processes combined with innovative machine learning to quickly isolate malicious behaviors,..."
Systems & Technology Research,"Data Scientist/Machine Learning Researcher - Arlington, VA", Implement advanced machine learning algorithms using probabilistic graphical models to estimate the states and evolution of dynamical systems....
The Johns Hopkins Applied Physics Laboratory,Remote Sensing Scientist PhD, Proficient in system development along the entire image processing chain from hardware to machine learning. Coordinate efforts with a multi-disciplinary team of...
Innovations for Poverty,Research Methods & Quality Director," Experience with advanced techniques such as machine learning preferred. Work with the GRDS team to review and build upon IPA’s current research protocols,..."
The Henry M. Jackson Foundation,Scientist," Experience implementing mathematical algorithms in prototype software, such as MatLab, ImageJ, IDL, Python or R and machine learning algorithms...."
University of Maryland,Assistant/Associate/Full Professor," Exceptional candidates in Machine Learning, Data Science, and Cybersecurity are being sought. The Department of Computer Science at the University of Maryland,..."
"Cylance, Inc.",DFIR Senior Consultant (Remote)," By successfully applying artificial intelligence and machine learning to crack the DNA of malware, Cylance has redefined the endpoint protection market,..."
American Chemical Society,Senior Modeler," Advanced machine learning/natural language processing NLP techniques and algorithms using R, Python (a plus)...."
Diverse Lynx,Machine Learning & Python Developer," Machine Learning &amp; Python Developer. Python, Java, Machine Learning, Natural Language Processing. Over all 5+ years software experience with Python, Java,..."
Ipsos North America,Sampling Statistician - Social and Opinion Research," Experience with longitudinal data analysis, Bayesian methods, machine learning, and advanced skills with SAS or R are preferred...."
IBM,Machine Learning/Computer Vision Consultant, (b) Be proficient in Machine Learning to include:. Minimum three years of experience with Machine Learning to include:. Training and Learning....
,Instructor - Big Data," Introduction to Data Science, Machine Learning &amp; AI. Instruction of Learning Tree courses following the course outline...."
Zignal Labs,Enterprise Account Development Representative," With unparalleled expertise in big data, machine learning and media measurement, Zignal empowers communications teams to confidently navigate an unpredictable..."
Splunk,Splunk Machine Learning & Analytics SE Architect," Math, Statistics or CS background with emphasis in Machine Learning. As a Splunk ML &amp; Analytics Architect, you will be a domain expert on Splunk Enterprise, and..."
"MTEQ, Inc.",Machine Learning Engineer, BS or MS degree in Computer Science with a specialization in Machine Learning or AI. MTEQ is seeking a highly motivated and creative Machine Learning/AI...
National Library of Medicine,Tenure-Eligible Senior Investigator," NLM seeks to recruit a Senior Investigator with significant experience in the use of statistical, bioinformatic, machine learning, optimization, and advanced..."
Bechtel,2019 University Graduates (U.S.) - Big Data Analytics (IS&T), Developing supervised and unsupervised machine learning models. No....
National Geographic Society,"Senior Director, Geographic Visualization"," Knowledge of artificial intelligence and machine learning, including deep learning, algorithms applied to remote sensing satellite and aerial datasets...."
Areté Associates,Image Processing Scientist, Machine learning and computer vision. Intellectual curiosity and desire for continuous learning. We provide staff with internal and external educational...
Micro Focus,"Software QA Engineer Internship - Vienna, VA"," DevOps | IT Operations| Cloud | Security | Info Governance | Big Data, Machine Learning, &amp; Analytics. Please note that our internships run in perpetuity..."
Unisys,Biometric SME," Experience with statistics, modeling and machine learning techniques a plus. Provide accuracy and biometric sample quality based on machine learning and..."
Booz Allen Hamilton,Search Lead," Are you fascinated by the possibilities presented by the IoT, machine learning, and artificial intelligence advances?..."
Gartner,"Quantitative Consultant - TalentNeuron, Gartner Research & Advisory"," The consultant will work closely with researcher, quantitative analysts and machine learning experts within the international Data Science teams to design and..."
All-In Analytics,Senior Machine Learning Data Scientist," Senior Machine Learning Data Scientist. Data science, machine learning, implementations and algorithm development;..."
National Security Agency,Software Engineer - Entry to Experienced Level," Information retrieval, machine learning, artificial intelligence, statistics and analytics. The professionals at the National Security Agency (NSA) have one..."
Bechtel,2019 Student Internship (U.S.) - Big Data Analytics (IS&T), Developing supervised and unsupervised machine learning models. No....
University of Maryland University College,Analytics Manager, Some knowledge of advanced analytics methodologies such as machine learning and statistical modeling. From an accredited institution of higher learning is...
Tunnell Consulting,Medical and Novel Healthcare Diagnostics SME," Focus on leveraging data science, machine learning, analytics, and bio-engineering coupled with near or on-patient devices &amp; capabilities...."
GEICO,Data Systems Analyst," As a systems analyst, you will work with Data Scientists and Machine Learning developers to:. Participate in a collaborative and learning environment and..."
The Henry M. Jackson Foundation,Postdoctoral Fellow," Furthermore, applicants with knowledge of machine learning approaches (e.g., elastic net regression, random forest, XGBoost) are of high interest...."
CrowdStrike,"Counsel, Employment & Litigation - East Coast"," Today, the company continues to drive major innovations around AI/machine learning, behavioral-based prevention and detection, etc.to stay ahead of adversaries...."
Choice Hotels,"Vice President, Business and Analytic Services"," Working knowledge of predictive modeling, machine learning, and simulation techniques. Develop state of the art data science and predictive modeling/machine..."
AstraZeneca,"Clinical Imaging Scientist, Immuno-Oncology"," Experience working with PACS systems and image analysis software, and having a basic understanding of the emerging integration of AI and machine learning in..."
HighPoint,Modeling Specialist," Selecting features, building and optimizing classifiers using machine learning techniques. We are looking for a statistical modeling specialist that enjoys..."
Fractal Industries,Sales Development Representative," We currently work with new and exciting technologies in cybersecurity, machine learning, artificial intelligence and DevOps, where we are building intelligent..."
TEGNA,VP Data & Insights," Prior experience with building statistical models, analyzing unstructured data, and machine learning / AI. Drive pragmatic approaches to solving key complex..."
National Security Agency,Mathematical Statistician - Entry/Mid-Level," Desire for continual learning. Mathematical Statisticians bring a wealth of expertise including, but not limited to, regression, machine learning, exploratory..."
Mission Support and Test Services,Senior Scientist," Radiation spectroscopy/imaging, numerical analysis, health physics, computational physics, computational modeling with MNCP, software/hardware interfaces,..."
ECS Federal LLC,Junior Scientist/Engineer," The successful candidate will likely support programs focused on physics, radiological/nuclear science, materials science, and machine learning...."
Envolve People Care,"Manager, Product Development"," Experience with machine learning and predictive analytics strongly preferred. Machine learning and/or predictive analytics, define data elements for reporting,..."
Engility,Physicist," Machine learning tools and techniques (e.g. Employ sophisticated analytics programs, machine learning and statistical methods to prepare data for use in..."
Concurrent Technologies Corporation,Machine Learning Forensic Analyst," MACHINE LEARNING FORENSIC ANALYST. Familiarity with machine learning deep learning libraries such as TensorFlow, Theano, MXNet, Dlib, or Deeplearning4j...."
Booz Allen Hamilton,Quantum Scientist," Experience with data science, including analysis, data visualization, and machine learning. Leverage technical and analytical expertise to review reports and..."
NT Concepts,C2S Migration Engineer," We don’t mean to brag, but we are working on some pretty challenging machine learning solutions for our clients...."
NT Concepts,Data Scientist - You Make Data Sing," You are familiar with a few machine learning frameworks, like TensorFlow or PyTorch. You’ll be an expert for clients, partnering closely with our team of..."
The Johns Hopkins Applied Physics Laboratory,Robotics Researcher Post-Doc Position," The current emphasis of the Intelligent Systems Group is on machine learning, autonomy, applied neuroscience, machine perception, and robotics...."
Booz Allen Hamilton,Machine Learning Engineer," Machine Learning Engineer. Experience with deep learning frameworks, including Deep learning 4j, TensorFlow, Kerras, Caffe or Theano...."
Vanda Pharmaceuticals Inc.,Data Scientist," Strong practical knowledge of analytical techniques and methodologies such as machine learning/supervised and unsupervised techniques, segmentation, mix and..."
C3 IoT,Forward Deployed Solution Leader (Federal)," Technical competency in Data Science, i.e. has experience in learning machine learning algorithms. Understanding of the competitive landscape in enterprise big..."
Diverse Lynx,Machine Learing Specialist," Machine Learning Specialist// Machine Learning Specialist. Big data engineering / data science / machine learning, including technology implementations and..."
FiscalNote,"Director, Product Management", Familiarity with Data Science needs for machine learning and natural language processing a plus. Product at FiscalNote....
GEICO,Voice Developer, • Knowledge and experience with machine learning technologies. Ready to make an impact?...
Research Innovations Inc,Machine Learning / Data Scientist," Developing Big Data and machine learning solutions; If you are a sharp, experienced engineer with demonstrated big data capabilities in deploying and..."
Microsoft,Public Sector Controller, You drive digital transformation in the finance function towards data driven (Machine Learning) forward-looking insights. Finance Controller - Public Sector....
"Ferguson Enterprises, Inc.",Workday Reporting Business Analyst," Mine internal and external labor data to create building blocks in our journey towards predictive analytics, machine learning, and robotics...."
Giant Oak,Social Scientist for Research and Testing, GOST® uses a variety of statistical and machine learning models to analyze disparate data in order to help customers prioritize workloads and find the...
Alarm.com,Data Analyst and Video Logistics Specialist, Develop programs for collection of data for the training and testing of machine learning algorithms. Understand product goals and vision to enable accurate...
Softrams,Product Architect," Experience with Big data technologies such as Hadoop, Spark, Machine Learning and multiple cloud environments (AWS, Google and Azure)...."
CrowdStrike,Digital Paid Media Manager," Today, the company continues to drive major innovations around AI/machine learning, behavioral-based prevention and detection, etc. to stay ahead of adversaries..."
Leidos,Technician I," Experience with big data, data analytics, and machine learning. Leidos currently has an opening for a Technician I to work in our Springfield VA office...."
Leidos,Senior Remote Sensor Scientist," Experience evaluating sources and methods (data and tradecraft) via machine learning for evidence of bias (confirmation, selection, cognitive, etc.)...."
Fannie Mae,Principal, Knowledge of advanced analytics concepts in data science and applying machine learning and statistical models on large data sets. KEY JOB FUNCTIONS....
QxBranch,Sales Executive," Understanding of advanced data analytics concepts including machine learning, high performance databases, industry best-practices, regulations, and industry..."
Greensmith Energy Management Systems,Software Engineer," Statistical analysis, time series models, or forecasting and machine learning. Greensmith, a Wärtsilä company, is the leading provider of energy control..."
